Symbol,Name,Last Sale,Net Change,% Change,Market Cap,Country,IPO Year,Volume,Sector,Industry
PNFPP,Pinnacle Financial Partners Inc. Depositary shares of Pinnacle Financial Partners Inc. each representing a 1/40th Interest in a share of its 6.75% Fixed-Rate Non-Cumulative Perpetual Preferred Stock Series B,$27.30,0.14,0.515%,0.00,United States,,27318,Finance,Major Banks
PNNT,PennantPark Investment Corporation Common Stock,$5.61,-0.06,-1.058%,376123039.00,United States,2007,486400,,
PNNTG,PennantPark Investment Corporation 5.50% Notes Due 2024,$25.57,-0.13,-0.506%,0.00,United States,,35419,,
PNRG,PrimeEnergy Resources Corporation Common Stock,$54.00,-1.20,-2.174%,107685558.00,United States,,713,Energy,Oil & Gas Production
PNTG,The Pennant Group Inc. Common Stock ,$47.54,2.32,5.13%,1343594829.00,United States,,113910,Health Care,Medical/Nursing Services
POAI,Predictive Oncology Inc. Common Stock,$1.23,0.01,0.82%,18967837.00,United States,,2424786,Health Care,Industrial Specialties
PODD,Insulet Corporation Common Stock,$259.17,-4.46,-1.692%,17126037571.00,United States,2007,529876,Health Care,Medical/Dental Instruments
POLA,Polar Power Inc. Common Stock,$12.38,2.33,23.184%,158317953.00,United States,2016,1554940,Miscellaneous,Industrial Machinery/Components
POOL,Pool Corporation Common Stock,$335.25,-4.85,-1.426%,13486896293.00,United States,1995,307592,Consumer Durables,Industrial Specialties
POSH,Poshmark Inc. Class A Common Stock,$38.33,-1.96,-4.865%,2876217426.00,United States,2021,795132,Consumer Services,Catalog/Specialty Distribution
POW,Powered Brands Class A Ordinary Shares,$9.638,0.018,0.187%,332511000.00,United States,2021,1574,Finance,Business Services
POWI,Power Integrations Inc. Common Stock,$78.73,-0.12,-0.152%,4728040319.00,United States,1997,285940,Technology,Semiconductors
POWL,Powell Industries Inc. Common Stock,$31.82,0.67,2.151%,371494459.00,United States,,50117,Consumer Durables,Electrical Products
POWRU,Powered Brands Units,$9.95,0.0454,0.458%,0.00,United States,2021,21314,Finance,Business Services
POWRW,Powered Brands Warrants,$0.92,0.0699,8.223%,0.00,United States,2021,22900,Finance,Business Services
POWW,AMMO Inc. Common Stock,$6.00,0.20,3.448%,555365334.00,United States,,2515801,Capital Goods,Ordnance And Accessories
PPBI,Pacific Premier Bancorp Inc,$43.21,1.19,2.832%,4074427579.00,United States,,303542,Finance,Major Banks
PPBT,Purple Biotech Ltd. American Depositary Shares,$4.29,-0.03,-0.694%,75120362.00,Israel,2015,221213,Health Care,Major Pharmaceuticals
PPC,Pilgrim's Pride Corporation Common Stock,$24.11,0.44,1.859%,5871086134.00,United States,,417943,Consumer Non-Durables,Meat/Poultry/Fish
PPD,PPD Inc. Common Stock,$36.86,0.24,0.655%,12916803393.00,United States,2020,721975,Health Care,Biotechnology: Commercial Physical & Biological Resarch
PPGH,Poema Global Holdings Corp. Class A Ordinary Share,$9.72,0.07,0.725%,419175000.00,China,2021,154760,Finance,Business Services
PPGHU,Poema Global Holdings Corp. Unit,$9.99,0.03,0.301%,0.00,China,2021,11835,Finance,Business Services
PPGHW,Poema Global Holdings Corp. Warrant,$0.60,-0.0599,-9.077%,0.00,China,2021,23545,Finance,Business Services
PPIH,Perma-Pipe International Holdings Inc. Common Stock,$6.79,0.23,3.506%,55440275.00,United States,,12220,Capital Goods,Pollution Control Equipment
PPSI,Pioneer Power Solutions Inc. Common Stock,$5.04,0.31,6.554%,43979267.00,United States,,401512,Consumer Durables,Electrical Products
PPTA,Perpetua Resources Corp. Common Shares,$6.4785,-0.0715,-1.092%,307875851.00,Canada,,47050,Basic Industries,Precious Metals
PRAA,PRA Group Inc. Common Stock,$36.31,0.55,1.538%,1655500893.00,United States,2002,184302,Finance,Finance: Consumer Services
PRAH,PRA Health Sciences Inc. Common Stock,$148.05,-0.65,-0.437%,9555734462.00,United States,2014,1027179,Health Care,Biotechnology: Commercial Physical & Biological Resarch
PRAX,Praxis Precision Medicines Inc. Common Stock,$32.26,-0.75,-2.272%,1244562250.00,United States,2020,139524,Health Care,Major Pharmaceuticals
PRCH,Porch Group Inc. Common Stock,$15.76,-0.415,-2.566%,1302598625.00,United States,2020,1618359,Technology,Computer Software: Prepackaged Software
PRCHW,Porch Group Inc. Warrant,$4.23,-0.45,-9.615%,0.00,United States,2020,58619,Technology,Computer Software: Prepackaged Software
PRDO,Perdoceo Education Corporation Common Stock,$12.18,0.39,3.308%,853359594.00,United States,,397291,Consumer Services,Other Consumer Services
PRFT,Perficient Inc. Common Stock,$58.58,0.71,1.227%,1934965294.00,United States,1999,152167,Technology,EDP Services
PRFX,PainReform Ltd. Ordinary Shares,$4.10,-0.35,-7.865%,41255770.00,Israel,2020,116045,Health Care,Major Pharmaceuticals
PRGS,Progress Software Corporation Common Stock (DE),$41.80,-0.02,-0.048%,1848239292.00,United States,1991,317215,Technology,Computer Software: Prepackaged Software
PRIM,Primoris Services Corporation Common Stock,$32.31,0.61,1.924%,1735803765.00,United States,,742736,Basic Industries,Water Supply
PRLD,Prelude Therapeutics Incorporated Common Stock,$45.98,-3.46,-6.998%,2142017843.00,United States,2020,375472,Health Care,Major Pharmaceuticals
PROF,Profound Medical Corp. Common Stock,$20.05,-0.38,-1.86%,406812475.00,Canada,,127929,Health Care,Medical/Dental Instruments
PROG,Progenity Inc. Common Stock,$4.13,0.01,0.243%,248840070.00,United States,1995,315733,Health Care,Medical Specialities
PROV,Provident Financial Holdings Inc. Common Stock,$17.13,0.17,1.002%,127485811.00,United States,,12622,Finance,Savings Institutions
PRPH,ProPhase Labs Inc. Common Stock (DE),$6.45,-0.29,-4.303%,97744932.00,United States,,120950,Health Care,Major Pharmaceuticals
PRPL,Purple Innovation Inc. Common Stock,$30.15,-0.17,-0.561%,2011844647.00,United States,2015,789356,Consumer Durables,Home Furnishings
PRPO,Precipio Inc.  Common Stock,$2.40,0.14,6.195%,41344598.00,United States,,155303,Capital Goods,Biotechnology: Laboratory Analytical Instruments
PRQR,ProQR Therapeutics N.V. Ordinary Shares,$9.22,3.54,62.324%,462888348.00,Netherlands,2014,149657433,Health Care,Major Pharmaceuticals
PRSR,Prospector Capital Corp. Class A Ordinary Shares,$9.69,0.04,0.415%,393656250.00,United States,2021,79977,Finance,Business Services
PRSRU,Prospector Capital Corp. Unit,$10.02,0.05,0.502%,0.00,United States,2021,15848,Finance,Business Services
PRSRW,Prospector Capital Corp. Warrants,$1.05,0.055,5.528%,0.00,United States,2021,40781,Finance,Business Services
PRTA,Prothena Corporation plc Ordinary Shares,$28.24,2.84,11.181%,1129239093.00,United States,,1144495,Health Care,Major Pharmaceuticals
PRTC,PureTech Health plc American Depositary Shares,$60.00,0.00,0.00%,1715392440.00,United Kingdom,,85,Health Care,Major Pharmaceuticals
PRTG,Portage Biotech Inc. Common Stock,$29.02,0.0199,0.069%,350660123.00,Canada,,9309,Energy,Oil & Gas Production
PRTH,Priority Technology Holdings Inc. Common Stock,$7.60,-0.24,-3.061%,512818307.00,United States,2016,86961,Miscellaneous,Business Services
PRTK,Paratek Pharmaceuticals Inc. Common Stock,$7.27,0.04,0.553%,331811568.00,United States,,312670,Health Care,Major Pharmaceuticals
PRTS,CarParts.com Inc. Common Stock,$13.53,0.39,2.968%,650692188.00,United States,2007,2425397,Consumer Services,Other Specialty Stores
PRVB,Provention Bio Inc. Common Stock,$11.45,-0.16,-1.378%,725640750.00,United States,2018,934090,Health Care,Major Pharmaceuticals
PS,Pluralsight Inc. Class A Common Stock,$22.30,-0.01,-0.045%,3312324100.00,United States,2018,13568893,Technology,Computer Software: Programming Data Processing
PSAC,Property Solutions Acquisition Corp. Common Stock,$11.61,-0.37,-3.088%,342686693.00,United States,2020,976967,Capital Goods,Auto Manufacturing
PSACU,Property Solutions Acquisition Corp. Unit,$14.29,-0.41,-2.789%,0.00,United States,2020,10156,Capital Goods,Auto Manufacturing
PSACW,Property Solutions Acquisition Corp. Warrant,$2.65,-0.19,-6.69%,0.00,United States,2020,271641,Capital Goods,Auto Manufacturing
PSAGU,Property Solutions Acquisition Corporation II Units,$9.87,0.09,0.92%,0.00,United States,2021,30979,Finance,Business Services
PSEC,Prospect Capital Corporation Common Stock,$7.70,0.08,1.05%,2979865966.00,United States,2004,2103912,,
PSHG,Performance Shipping Inc. Common Shares,$5.30,0.06,1.145%,26938448.00,Greece,,44883,Transportation,Marine Transportation
PSMT,PriceSmart Inc. Common Stock,$93.79,1.24,1.34%,2882948346.00,United States,,81213,Consumer Services,Department/Specialty Retail Stores
PSNL,Personalis Inc. Common Stock,$22.29,0.35,1.595%,973946460.00,United States,2019,1224892,Health Care,Medical Specialities
PSTI,Pluristem Therapeutics Inc. Common Stock,$5.04,0.18,3.704%,158907506.00,Israel,,421263,Health Care,Biotechnology: Biological Products (No Diagnostic Substances)
PSTV,PLUS THERAPEUTICS Inc. Common Stock ,$2.44,-0.13,-5.058%,22367241.00,United States,,569486,Health Care,Medical/Dental Instruments
PSTX,Poseida Therapeutics Inc. Common Stock,$9.42,-0.19,-1.977%,585058943.00,United States,2020,198657,Health Care,Biotechnology: Biological Products (No Diagnostic Substances)
PT,Pintec Technology Holdings Limited American Depositary Shares,$1.20,0.02,1.695%,51765907.00,China,2018,404864,Technology,Computer Software: Programming Data Processing
PTC,PTC Inc. Common Stock,$128.00,1.16,0.915%,14951733504.00,United States,,617414,Technology,Computer Software: Prepackaged Software
PTCT,PTC Therapeutics Inc. Common Stock,$50.08,0.55,1.11%,3521741786.00,United States,2013,506619,Health Care,Major Pharmaceuticals
PTE,PolarityTE Inc. Common Stock,$1.13,0.03,2.727%,75487189.00,United States,,2686263,Health Care,Biotechnology: Biological Products (No Diagnostic Substances)
PTEN,Patterson-UTI Energy Inc. Common Stock,$7.40,0.42,6.017%,1389249515.00,United States,1993,3451920,Energy,Oil & Gas Production
PTGX,Protagonist Therapeutics Inc. Common Stock,$28.52,1.08,3.936%,1249412944.00,United States,2016,242885,Health Care,Major Pharmaceuticals
PTIC,PropTech Investment Corporation II Class A Common Stock,$9.93,-0.05,-0.501%,0.00,United States,2021,21632,Finance,Business Services
PTICU,PropTech Investment Corporation II Unit,$10.24,0.00,0.00%,0.00,United States,2020,3065,Finance,Business Services
PTICW,PropTech Investment Corporation II Warrant,$0.9601,0.0076,0.798%,0.00,United States,2021,13065,Finance,Business Services
PTMN,Portman Ridge Finance Corporation Common Stock,$2.17,0.06,2.844%,163173456.00,United States,,507816,,
PTNR,Partner Communications Company Ltd. American Depositary Shares,$4.89,-0.015,-0.306%,898397475.00,Israel,,7402,Public Utilities,Telecommunications Equipment
PTOCU,Pine Technology Acquisition Corp. Unit,$9.89,0.06,0.61%,0.00,United States,2021,30225,Finance,Business Services
PTON,Peloton Interactive Inc. Class A Common Stock,$103.23,1.44,1.415%,30401406878.00,United States,2019,8351113,Energy,Consumer Electronics/Appliances
PTPI,Petros Pharmaceuticals Inc. Common Stock,$3.89,0.63,19.325%,37998776.00,United States,,291586,Health Care,Major Pharmaceuticals
PTRS,Partners Bancorp Common Stock,$7.50,0.10,1.351%,133576598.00,United States,,7785,Finance,Major Banks
PTSI,P.A.M. Transportation Services Inc. Common Stock,$59.80,1.81,3.121%,342351352.00,United States,1986,9926,Transportation,Trucking Freight/Courier Services
PTVCA,Protective Insurance Corporation Class A Common Stock,$23.00,0.00,0.00%,325591473.00,United States,,9,Finance,Property-Casualty Insurers
PTVCB,Protective Insurance Corporation Class B Common Stock,$22.98,0.03,0.131%,325308350.00,United States,,38605,Finance,Property-Casualty Insurers
PTVE,Pactiv Evergreen Inc. Common stock,$14.70,-0.12,-0.81%,2604218337.00,United States,2020,321600,Consumer Durables,Containers/Packaging
PUBM,PubMatic Inc. Class A Common Stock,$46.26,-2.18,-4.50%,2212454075.00,United States,2020,527281,Technology,Computer Software: Programming Data Processing
PUCKU,Goal Acquisitions Corp. Unit,$9.94,-0.01,-0.101%,0.00,United States,2021,105451,Finance,Business Services
PULM,Pulmatrix Inc. Common Stock,$1.39,-0.01,-0.714%,77986085.00,United States,2014,1096891,Health Care,Major Pharmaceuticals
PUYI,Puyi Inc. American Depository Shares,$5.23,-0.17,-3.148%,315445755.00,China,2019,116776,Finance,Investment Managers
PVAC,Penn Virginia Corporation Common Stock,$13.58,-0.25,-1.808%,207320401.00,United States,,428436,Energy,Oil & Gas Production
PVBC,Provident Bancorp Inc. (MD) Common Stock,$14.04,0.64,4.776%,253387518.00,United States,2015,49679,Finance,Savings Institutions
PWFL,PowerFleet Inc. Common Stock,$8.60,0.37,4.496%,309400557.00,United States,,112779,Capital Goods,Telecommunications Equipment
PWOD,Penns Woods Bancorp Inc. Common Stock,$24.52,0.72,3.025%,173030578.00,United States,,13028,Finance,Major Banks
PXLW,Pixelworks Inc.  Common Stock,$3.43,0.14,4.255%,179088604.00,United States,2000,477516,Technology,Semiconductors
PXS,Pyxis Tankers Inc. Common Stock,$1.15,0.07,6.481%,24793868.00,Greece,,4947034,Transportation,Marine Transportation
PXSAP,Pyxis Tankers Inc. 7.75% Series A Cumulative Convertible Preferred Shares,$21.34,-1.46,-6.404%,0.00,Greece,,2231,Transportation,Marine Transportation
PXSAW,Pyxis Tankers Inc. Warrant,$0.4096,0.0194,4.972%,0.00,Greece,,89121,Transportation,Marine Transportation
PYPD,PolyPid Ltd. Ordinary Shares,$9.68,-0.21,-2.123%,181452975.00,Israel,2020,24647,Health Care,Medical/Dental Instruments
PYPL,PayPal Holdings Inc. Common Stock,$234.24,-0.03,-0.013%,274336210022.00,United States,,8842122,Miscellaneous,Business Services
PYR,PyroGenesis Canada Inc. Common Shares,$6.95,0.50,7.752%,1109681925.00,Canada,,265187,Health Care,Major Pharmaceuticals
PZZA,Papa John's International Inc. Common Stock,$87.40,1.41,1.64%,2877917076.00,United States,1993,539839,Consumer Services,Restaurants
QADA,QAD Inc. Class A Common Stock,$64.36,4.38,7.302%,1332192596.00,United States,,80839,Technology,Computer Software: Prepackaged Software
QADB,QAD Inc. Class B Common Stock,$45.99,3.89,9.24%,951950551.00,United States,,2498,Technology,Computer Software: Prepackaged Software
QCOM,QUALCOMM Incorporated Common Stock,$127.28,0.10,0.079%,144590080000.00,United States,1991,10455759,Technology,Radio And Television Broadcasting And Communications Equipment
QCRH,QCR Holdings Inc. Common Stock,$46.47,0.78,1.707%,735478506.00,United States,,42862,Finance,Major Banks
QDEL,Quidel Corporation Common Stock,$126.13,-2.66,-2.065%,5337709975.00,United States,,1136247,Health Care,Biotechnology: In Vitro & In Vivo Diagnostic Substances
QELL,Qell Acquisition Corp. Class A Ordinary Shares,$9.97,-0.02,-0.20%,472951875.00,United States,2020,953147,Finance,Business Services
QELLU,Qell Acquisition Corp. Unit,$10.48,0.07,0.672%,0.00,United States,2020,20494,Finance,Business Services
QELLW,Qell Acquisition Corp. Warrant,$1.64,-0.15,-8.38%,0.00,United States,2020,160287,Finance,Business Services
QFIN,360 DigiTech Inc. American Depositary Shares,$24.18,0.68,2.894%,3678057231.00,China,2018,4485770,Finance,Finance: Consumer Services
QH,Quhuo Limited American Depository Shares,$6.31,-0.04,-0.63%,327529447.00,China,2020,36564,Miscellaneous,Business Services
QIWI,QIWI plc American Depositary Shares,$10.16,-0.08,-0.781%,637163826.00,Cyprus,2013,317642,Miscellaneous,Business Services
QK,Q&K International Group Limited American Depositary Shares,$2.51,-0.09,-3.462%,136070441.00,China,2019,26207,Finance,Real Estate
QLGN,Qualigen Therapeutics Inc. Common Stock,$2.74,0.08,3.008%,73177314.00,United States,2015,529864,Health Care,Major Pharmaceuticals
QLI,Qilian International Holding Group Ltd. Ordinary Shares,$4.48,-0.08,-1.754%,160160000.00,China,2021,70826,Health Care,Major Pharmaceuticals
QLYS,Qualys Inc. Common Stock,$100.33,-0.35,-0.348%,3933712053.00,United States,2012,358076,Technology,Computer Software: Prepackaged Software
QMCO,Quantum Corporation Common Stock,$7.90,-0.15,-1.863%,447639335.00,United States,,524799,Technology,Electronic Components
QNST,QuinStreet Inc. Common Stock,$20.16,-0.31,-1.514%,1074457460.00,United States,2010,461670,Miscellaneous,Business Services
QQQX,Nuveen NASDAQ 100 Dynamic Overwrite Fund Shares of Beneficial Interest,$26.89,-0.37,-1.357%,1116147485.00,United States,,169980,,
QRHC,Quest Resource Holding Corporation Common Stock,$4.28,0.06,1.422%,78809433.00,United States,,262535,Technology,Diversified Commercial Services
QRTEA,Qurate Retail Inc. Series A Common Stock ,$11.75,0.29,2.531%,4822349636.00,United States,,3068750,Consumer Services,Catalog/Specialty Distribution
QRTEB,Qurate Retail Inc. Series B Common Stock ,$11.65,0.14,1.216%,4770925347.00,United States,,4499,Consumer Services,Catalog/Specialty Distribution
QRTEP,Qurate Retail Inc. 8.0% Fixed Rate Cumulative Redeemable Preferred Stock,$101.72,-0.01,-0.01%,0.00,United States,,22558,Consumer Services,Catalog/Specialty Distribution
QRVO,Qorvo Inc. Common Stock,$172.26,0.47,0.274%,19510633908.00,United States,,796552,Technology,Semiconductors
QTNT,Quotient Limited Ordinary Shares,$3.80,0.13,3.542%,384306361.00,Switzerland,2014,692529,Health Care,Biotechnology: In Vitro & In Vivo Diagnostic Substances
QTRX,Quanterix Corporation Common Stock,$53.61,1.51,2.898%,1944306518.00,United States,2017,290060,Capital Goods,Biotechnology: Laboratory Analytical Instruments
QTT,Qutoutiao Inc. American Depositary Shares,$2.26,-0.04,-1.739%,603026878.00,China,2018,3924612,Technology,Computer Software: Programming Data Processing
QUIK,QuickLogic Corporation Common Stock,$7.19,0.18,2.568%,79582364.00,United States,1999,143512,Technology,Semiconductors
QUMU,Qumu Corporation Common Stock,$6.44,-0.06,-0.923%,113214743.00,United States,,146123,Technology,Computer Software: Prepackaged Software
QURE,uniQure N.V. Ordinary Shares,$30.01,0.34,1.146%,1350269550.00,Netherlands,2014,599625,Health Care,Major Pharmaceuticals
RAAC,Revolution Acceleration Acquisition Corp Class A Common Stock,$10.14,0.09,0.896%,388699997.00,United States,2021,1094592,Finance,Business Services
RAACU,Revolution Acceleration Acquisition Corp Unit,$10.69,0.03,0.281%,0.00,United States,2020,38673,Finance,Business Services
RAACW,Revolution Acceleration Acquisition Corp Warrant,$2.00,0.07,3.627%,0.00,United States,2021,405464,Finance,Business Services
RACA,Therapeutics Acquisition Corp. Class A Common Stock,$10.67,0.60,5.958%,186019713.00,United States,2020,529081,Finance,Business Services
RACB,Research Alliance Corp. II Class A Common Stock,$10.18,0.0179,0.176%,170107800.00,United States,2021,53734,Finance,Business Services
RADA,RADA Electronic Industries Ltd. Ordinary Shares,$11.31,-0.17,-1.481%,491816085.00,Israel,,1637467,Technology,Electronic Components
RADI,Radius Global Infrastructure Inc. Class A Common Stock,$13.05,-0.06,-0.458%,794737444.00,United States,,559413,Consumer Services,Real Estate
RAIL,FreightCar America Inc. Common Stock,$4.80,0.91,23.393%,74567179.00,United States,2005,17841043,Capital Goods,Railroads
RAND,Rand Capital Corporation Common Stock,$18.325,0.895,5.135%,47318247.00,United States,,8724,Finance,Finance: Consumer Services
RAPT,RAPT Therapeutics Inc. Common Stock,$21.31,0.45,2.157%,529899745.00,United States,2019,88214,Health Care,Major Pharmaceuticals
RARE,Ultragenyx Pharmaceutical Inc. Common Stock,$110.82,-0.13,-0.117%,7419315220.00,United States,2014,794644,Health Care,Major Pharmaceuticals
RAVE,Rave Restaurant Group Inc. Common Stock,$1.44,-0.09,-5.882%,25927062.00,United States,,528702,Consumer Non-Durables,Food Distributors
RAVN,Raven Industries Inc. Common Stock,$33.44,1.64,5.157%,1198950570.00,United States,,462680,Capital Goods,Specialty Chemicals
RBB,RBB Bancorp Common Stock,$20.22,0.62,3.163%,394643567.00,United States,2017,25919,Finance,Major Banks
RBBN,Ribbon Communications Inc. Common Stock,$8.06,0.19,2.414%,1173188928.00,United States,,539066,Technology,EDP Services
RBCAA,Republic Bancorp Inc. Class A Common Stock,$45.23,1.60,3.667%,943688580.00,United States,1998,40501,Finance,Major Banks
RBCN,Rubicon Technology Inc. Common Stock,$10.67,-0.1525,-1.409%,25845461.00,United States,2007,3946,Technology,Semiconductors
RBKB,Rhinebeck Bancorp Inc. Common Stock,$10.48,0.10,0.963%,116676879.00,United States,2019,3654,Finance,Banks
RBNC,Reliant Bancorp Inc. Common Stock,$27.72,0.21,0.763%,454273725.00,United States,,66509,Finance,Major Banks
RCEL,Avita Therapeutics Inc. Common Stock,$20.60,0.28,1.378%,511763390.00,Australia,,141805,Health Care,Medical/Dental Instruments
RCHG,Recharge Acquisition Corp. Class A Common Stock,$9.72,-0.06,-0.613%,250290000.00,United States,2020,5515,Finance,Business Services
RCHGU,Recharge Acquisition Corp. Unit,$10.03,-0.19,-1.859%,0.00,United States,2020,10236,Finance,Business Services
RCHGW,Recharge Acquisition Corp. Warrant,$0.6999,0.00,0.00%,0.00,United States,2020,50325,Finance,Business Services
RCII,Rent-A-Center Inc. Common Stock,$57.83,2.21,3.973%,3146745254.00,United States,1995,431414,Technology,Diversified Commercial Services
RCKT,Rocket Pharmaceuticals Inc. Common Stock,$47.67,1.44,3.115%,2944970560.00,United States,2015,586725,Health Care,Major Pharmaceuticals
RCKY,Rocky Brands Inc. Common Stock,$48.14,4.54,10.413%,349058856.00,United States,1993,127204,Consumer Non-Durables,Shoe Manufacturing
RCLFU,Rosecliff Acquisition Corp I Unit,$9.81,-0.035,-0.356%,0.00,United States,2021,17122,Finance,Business Services
RCM,R1 RCM Inc. Common Stock,$24.20,0.37,1.553%,6317802451.00,United States,,787018,Consumer Services,Other Consumer Services
RCMT,RCM Technologies Inc. Common Stock,$3.80,0.51,15.502%,45424934.00,United States,,961092,Technology,Professional Services
RCON,Recon Technology Ltd. Ordinary Shares,$6.35,0.81,14.621%,45737983.00,China,2009,2471594,Energy,Oilfield Services/Equipment
RDCM,Radcom Ltd. Ordinary Shares,$9.3828,-0.1272,-1.338%,130830536.00,Israel,1997,2534,Technology,Computer peripheral equipment
RDFN,Redfin Corporation Common Stock,$64.35,1.19,1.884%,6641334028.00,United States,2017,1907488,Finance,Real Estate
RDHL,Redhill Biopharma Ltd. American Depositary Shares,$6.98,-0.13,-1.828%,3238364369.00,Israel,,377898,Health Care,Major Pharmaceuticals
RDI,Reading International Inc Class A Common Stock,$6.00,-0.10,-1.639%,130495182.00,United States,,44214,Consumer Services,Movies/Entertainment
RDIB,Reading International Inc Class B Common Stock,$20.0001,0.00,0.00%,434986115.00,United States,,87,Consumer Services,Movies/Entertainment
RDNT,RadNet Inc. Common Stock,$21.89,0.52,2.433%,1144236094.00,United States,,107383,Health Care,Medical Specialities
RDUS,Radius Health Inc. Common Stock,$22.405,-0.61,-2.65%,1050669682.00,United States,2014,776933,Health Care,Major Pharmaceuticals
RDVT,Red Violet Inc. Common Stock ,$18.35,0.02,0.109%,223871413.00,United States,,35751,Technology,Computer Software: Prepackaged Software
RDWR,Radware Ltd. Ordinary Shares,$25.94,-0.21,-0.803%,1197395017.00,Israel,1999,126280,Miscellaneous,Business Services
REAL,The RealReal Inc. Common Stock,$21.84,0.80,3.802%,1962001205.00,United States,2019,1720835,Consumer Services,Other Specialty Stores
REDU,RISE Education Cayman Ltd American Depositary Shares,$4.61,-0.56,-10.832%,259903322.00,China,2017,24729,Consumer Services,Other Consumer Services
REED,Reeds Inc. Common Stock,$1.08,0.01,0.935%,90181724.00,United States,,430179,Consumer Non-Durables,Beverages (Production/Distribution)
REFR,Research Frontiers Incorporated Common Stock,$3.04,0.13,4.467%,96217204.00,United States,,127362,Miscellaneous,Multi-Sector Companies
REG,Regency Centers Corporation Common Stock,$57.05,1.65,2.978%,9688741769.00,United States,1993,1405851,Consumer Services,Real Estate Investment Trusts
REGI,Renewable Energy Group Inc. Common Stock,$63.44,-0.17,-0.267%,2495402186.00,United States,2012,1920904,Basic Industries,Major Chemicals
REGN,Regeneron Pharmaceuticals Inc. Common Stock,$463.48,3.16,0.686%,49653492549.00,United States,1991,1413495,Health Care,Major Pharmaceuticals
REKR,Rekor Systems Inc. Common Stock,$18.96,1.41,8.034%,773647992.00,United States,,1153907,Capital Goods,Telecommunications Equipment
RELI,Reliance Global Group Inc. Common Stock,$4.41,0.15,3.521%,18354927.00,United States,,43391,Finance,Specialty Insurers
RELIW,Reliance Global Group Inc. Series A Warrants,$1.06,-0.01,-0.935%,0.00,United States,,16280,Finance,Specialty Insurers
RELL,Richardson Electronics Ltd. Common Stock,$6.25,-0.23,-3.549%,82547838.00,United States,1983,50559,Technology,Electronic Components
REPH,Recro Pharma Inc. Common Stock,$3.22,0.12,3.871%,106950442.00,United States,2014,258921,Health Care,Major Pharmaceuticals
REPL,Replimune Group Inc. Common Stock,$31.75,1.53,5.063%,1476167577.00,United States,2018,455373,Health Care,Biotechnology: Biological Products (No Diagnostic Substances)
RESN,Resonant Inc. Common Stock,$4.21,0.12,2.934%,253103255.00,United States,2014,1138478,Technology,Semiconductors
RETA,Reata Pharmaceuticals Inc. Class A Common Stock,$100.91,1.01,1.011%,3653035342.00,United States,2016,561215,Health Care,Major Pharmaceuticals
RETO,ReTo Eco-Solutions Inc. Common Shares,$1.45,-0.08,-5.229%,34995750.00,China,2017,350294,Capital Goods,Industrial Machinery/Components
REVHU,Revolution Healthcare Acquisition Corp. SAIL Units,$9.97,0.00,0.00%,0.00,United States,2021,211328,Finance,Business Services
REYN,Reynolds Consumer Products Inc. Common Stock,$30.00,0.15,0.503%,6291015000.00,United States,2020,409950,Consumer Durables,Containers/Packaging
RFIL,RF Industries Ltd. Common Stock,$6.15,0.02,0.326%,61330604.00,United States,,35096,Capital Goods,Electrical Products
RGCO,RGC Resources Inc. Common Stock,$22.18,-0.47,-2.075%,182218437.00,United States,,28954,Public Utilities,Oil & Gas Production
RGEN,Repligen Corporation Common Stock,$180.37,-8.68,-4.591%,9879107137.00,United States,1986,635407,Health Care,Biotechnology: Biological Products (No Diagnostic Substances)
