Symbol,Name,Last Sale,Net Change,% Change,Market Cap,Country,IPO Year,Volume,Sector,Industry
CTRE,CareTrust REIT Inc. Common Stock,$23.42,0.09,0.386%,2248901519.00,United States,,426216,Consumer Services,Real Estate Investment Trusts
CTRM,Castor Maritime Inc. Common Shares,$0.8281,0.0521,6.714%,421720174.00,Cyprus,,78471440,Transportation,Marine Transportation
CTRN,Citi Trends Inc. Common Stock,$83.62,3.75,4.695%,847820002.00,United States,2005,163476,Consumer Services,Clothing/Shoe/Accessory Stores
CTSH,Cognizant Technology Solutions Corporation Class A Common Stock,$77.10,0.16,0.208%,40910359292.00,United States,1998,2935485,Technology,EDP Services
CTSO,Cytosorbents Corporation Common Stock,$8.65,0.12,1.407%,373315653.00,United States,,209933,Health Care,Medical/Dental Instruments
CTXR,Citius Pharmaceuticals Inc. Common Stock,$1.93,-0.08,-3.98%,242765226.00,United States,,7881141,Health Care,Major Pharmaceuticals
CTXRW,Citius Pharmaceuticals Inc. Warrant,$0.80,-0.0126,-1.551%,0.00,United States,,8254,Health Care,Major Pharmaceuticals
CTXS,Citrix Systems Inc. Common Stock,$135.09,0.06,0.044%,16611169880.00,United States,1995,1171585,Technology,Computer Software: Prepackaged Software
CUBA,Herzfeld Caribbean Basin Fund Inc. (The) Common Stock,$5.85,-0.07,-1.182%,35881940.00,United States,,33258,,
CUE,Cue Biopharma Inc. Common Stock,$12.28,0.26,2.163%,374015030.00,United States,2018,258004,Health Care,Major Pharmaceuticals
CUEN,Cuentas Inc. Common Stock,$3.62,0.12,3.429%,48669166.00,United States,,429152,Consumer Non-Durables,Food Distributors
CUENW,Cuentas Inc. Warrant,$0.9299,0.05,5.682%,0.00,United States,,850,Consumer Non-Durables,Food Distributors
CURI,CuriosityStream Inc. Class A Common Stock,$14.70,0.12,0.823%,702387741.00,United States,2020,1118413,Consumer Services,Movies/Entertainment
CURIW,CuriosityStream Inc. Warrant,$5.63,0.03,0.536%,0.00,United States,2020,7367,Consumer Services,Movies/Entertainment
CUTR,Cutera Inc. Common Stock,$29.34,-0.28,-0.945%,517341922.00,United States,2004,189434,Health Care,Biotechnology: Electromedical & Electrotherapeutic Apparatus
CVAC,CureVac N.V. Ordinary Shares,$84.72,1.07,1.279%,15835310026.00,Germany,2020,773219,Health Care,Major Pharmaceuticals
CVBF,CVB Financial Corporation Common Stock,$22.46,0.32,1.445%,3045587252.00,United States,,703955,Finance,Major Banks
CVCO,Cavco Industries Inc. Common Stock When Issued,$225.89,8.72,4.015%,2076434416.00,United States,,37015,Basic Industries,Homebuilding
CVCY,Central Valley Community Bancorp Common Stock,$18.93,0.72,3.954%,237084223.00,United States,,36742,Finance,Major Banks
CVET,Covetrus Inc. Common Stock,$30.54,0.64,2.14%,4160314218.00,United States,,820044,Health Care,Medical/Nursing Services
CVGI,Commercial Vehicle Group Inc. Common Stock,$9.89,0.04,0.406%,321554243.00,United States,2004,392855,Capital Goods,Auto Parts:O.E.M.
CVGW,Calavo Growers Inc. Common Stock,$75.78,0.78,1.04%,1341306000.00,United States,,82240,Consumer Non-Durables,Farming/Seeds/Milling
CVLG,Covenant Logistics Group Inc. Class A Common Stock,$19.26,0.16,0.838%,323568039.00,United States,,36514,Transportation,Trucking Freight/Courier Services
CVLT,Commvault Systems Inc. Common Stock,$63.55,0.80,1.275%,2986698497.00,United States,2006,341685,Technology,Computer Software: Prepackaged Software
CVLY,Codorus Valley Bancorp Inc Common Stock,$18.35,0.02,0.109%,180563835.00,United States,,11991,Finance,Savings Institutions
CVV,CVD Equipment Corporation Common Stock,$4.49,0.16,3.695%,29851756.00,United States,,29570,Technology,Industrial Machinery/Components
CWBC,Community West Bancshares Common Stock,$13.2095,0.0095,0.072%,112321211.00,United States,,9140,Finance,Major Banks
CWBR,CohBar Inc. Common Stock,$1.37,-0.01,-0.725%,83731008.00,United States,,377339,Health Care,Major Pharmaceuticals
CWCO,Consolidated Water Co. Ltd. Ordinary Shares,$13.41,0.23,1.745%,202799095.00,Cayman Islands,,63425,Public Utilities,Water Supply
CWST,Casella Waste Systems Inc. Class A Common Stock,$64.87,0.89,1.391%,3314179173.00,United States,1997,149607,Public Utilities,Environmental Services
CXDC,China XD Plastics Company Limited Common Stock,$1.08,-0.03,-2.703%,76192748.00,China,,96007,Capital Goods,Containers/Packaging
CXDO,Crexendo Inc. Common Stock,$6.35,-0.09,-1.398%,116818391.00,United States,,22656,Public Utilities,Telecommunications Equipment
CYAD,Celyad Oncology SA American Depositary Shares,$7.30,-0.31,-4.074%,103697639.00,Belgium,2015,8001,Health Care,Major Pharmaceuticals
CYAN,Cyanotech Corporation Common Stock,$3.22,-0.03,-0.923%,19632575.00,United States,,5481,Consumer Durables,Specialty Chemicals
CYBE,CyberOptics Corporation Common Stock,$24.57,0.80,3.366%,179308592.00,United States,1987,89026,Capital Goods,Electronic Components
CYBR,CyberArk Software Ltd. Ordinary Shares,$130.87,-3.60,-2.677%,5115512257.00,Israel,2014,641477,Technology,Computer Software: Prepackaged Software
CYCC,Cyclacel Pharmaceuticals Inc. Common Stock,$7.43,0.20,2.766%,68221250.00,United States,,263562,Health Care,Major Pharmaceuticals
CYCCP,Cyclacel Pharmaceuticals Inc. 6% Convertible Preferred Stock,$6.8583,0.00,0.00%,0.00,United States,,5,Health Care,Major Pharmaceuticals
CYCN,Cyclerion Therapeutics Inc. Common Stock,$3.48,0.19,5.775%,118510370.00,United States,,194969,Health Care,Major Pharmaceuticals
CYRN,CYREN Ltd. Ordinary Shares,$0.87,0.0164,1.921%,65021840.00,United States,,1667683,Technology,Computer Software: Prepackaged Software
CYRX,CryoPort Inc. Common Stock,$50.30,0.31,0.62%,2293912285.00,United States,,496839,Health Care,Major Pharmaceuticals
CYTH,Cyclo Therapeutics Inc. Common Stock,$9.00,-1.96,-17.883%,56636532.00,United States,,4475922,Basic Industries,Major Chemicals
CYTHW,Cyclo Therapeutics Inc. Warrant,$4.39,-1.64,-27.197%,0.00,United States,,98656,Basic Industries,Major Chemicals
CYTK,Cytokinetics Incorporated Common Stock,$24.00,1.60,7.143%,1706653824.00,United States,2004,922671,Health Care,Major Pharmaceuticals
CZNC,Citizens & Northern Corp Common Stock,$23.46,0.73,3.212%,375382240.00,United States,,25462,Finance,Major Banks
CZR,Caesars Entertainment Inc. Common Stock,$86.94,4.04,4.873%,18107640112.00,United States,,4447066,Consumer Services,Hotels/Resorts
CZWI,Citizens Community Bancorp Inc. Common Stock,$12.88,0.10,0.782%,140396405.00,United States,,2100,Finance,Savings Institutions
DADA,Dada Nexus Limited American Depositary Shares,$26.28,-1.25,-4.541%,6185327709.00,China,2020,3208783,Technology,Computer Software: Programming Data Processing
DAIO,Data I/O Corporation Common Stock,$5.30,0.00,0.00%,44606576.00,United States,1981,19856,Capital Goods,Electrical Products
DAKT,Daktronics Inc. Common Stock,$5.95,0.03,0.507%,267549967.00,United States,1994,245166,Consumer Durables,Miscellaneous manufacturing industries
DARE,Dare Bioscience Inc. Common Stock,$1.80,-0.06,-3.226%,74873255.00,United States,2014,1356670,Health Care,Major Pharmaceuticals
DBDR,Roman DBDR Tech Acquisition Corp. Class A Common Stock,$9.92,-0.085,-0.85%,287134400.00,United States,2020,37711,Finance,Business Services
DBDRU,Roman DBDR Tech Acquisition Corp. Unit,$10.2138,-0.0756,-0.735%,0.00,United States,2020,700,Finance,Business Services
DBDRW,Roman DBDR Tech Acquisition Corp. Warrant,$0.85,-0.1375,-13.924%,0.00,United States,2020,68549,Finance,Business Services
DBTX,Decibel Therapeutics Inc. Common Stock,$12.23,-0.32,-2.55%,297208287.00,United States,2021,129028,Health Care,Major Pharmaceuticals
DBVT,DBV Technologies S.A. American Depositary Shares,$5.31,-0.11,-2.03%,583427616.00,France,2014,88611,Health Care,Biotechnology: Biological Products (No Diagnostic Substances)
DBX,Dropbox Inc. Class A Common Stock,$26.35,-0.19,-0.716%,10927791712.00,United States,2018,8833979,Technology,Computer Software: Prepackaged Software
DCBO,Docebo Inc. Common Shares,$39.01,-0.39,-0.99%,1275214196.00,Canada,,102209,Technology,Computer Software: Prepackaged Software
DCOM,Dime Community Bancshares Inc. Common Stock,$30.43,0.58,1.943%,1262488208.00,United States,,131758,Finance,Savings Institutions
DCOMP,Dime Community Bancshares Inc. Fixed-Rate Non-Cumulative Perpetual Preferred Stock Series A,$25.25,0.15,0.598%,0.00,United States,,4431,Finance,Major Banks
DCPH,Deciphera Pharmaceuticals Inc. Common Stock,$43.69,0.74,1.723%,2517677450.00,United States,2017,291567,Health Care,Major Pharmaceuticals
DCRB,Decarbonization Plus Acquisition Corporation Class A Common Stock,$10.29,-0.01,-0.097%,290338802.00,United States,2020,636693,Finance,Business Services
DCRBU,Decarbonization Plus Acquisition Corporation Unit,$11.18,0.16,1.452%,0.00,United States,2020,36279,Finance,Business Services
DCRBW,Decarbonization Plus Acquisition Corporation Warrant,$1.80,0.06,3.448%,0.00,United States,2020,158955,Finance,Business Services
DCRCU,Decarbonization Plus Acquisition Corporation III Unit,$9.85,-0.03,-0.304%,0.00,United States,2021,2967702,,
DCRNU,Decarbonization Plus Acquisition Corporation II Unit,$9.90,-0.02,-0.202%,0.00,United States,2021,408256,Finance,Business Services
DCT,Duck Creek Technologies Inc. Common Stock,$42.82,0.04,0.094%,5610476455.00,United States,2020,386881,Technology,Computer Software: Prepackaged Software
DCTH,Delcath Systems Inc. Common Stock,$16.82,-0.38,-2.209%,105113344.00,United States,,90643,Health Care,Medical/Dental Instruments
DDMX,DD3 Acquisition Corp. II Class A Common Stock,$9.88,0.13,1.333%,71365216.00,Mexico,2021,23054,Finance,Business Services
DDMXU,DD3 Acquisition Corp. II Unit,$10.30,-0.06,-0.579%,0.00,Mexico,2020,19293,Finance,Business Services
DDMXW,DD3 Acquisition Corp. II Warrant,$1.1001,-0.1099,-9.083%,0.00,Mexico,2021,12550,Finance,Business Services
DDOG,Datadog Inc. Class A Common Stock,$78.26,-3.00,-3.692%,23986046312.00,United States,2019,5458587,Technology,Computer Software: Prepackaged Software
DENN,Denny's Corporation Common Stock,$18.35,0.91,5.218%,1177057906.00,United States,,479230,Consumer Services,Restaurants
DFFN,Diffusion Pharmaceuticals Inc. Common Stock,$0.9571,0.0451,4.945%,97532298.00,United States,,4298905,Health Care,Major Pharmaceuticals
DFH,Dream Finders Homes Inc. Class A Common Stock,$21.88,-0.12,-0.545%,2024370026.00,United States,2021,126880,Capital Goods,Homebuilding
DFHT,Deerfield Healthcare Technology Acquisitions Corp. Class A Common Stock,$13.53,-0.29,-2.098%,243117188.00,United States,2020,16081,Health Care,Hospital/Nursing Management
DFHTU,Deerfield Healthcare Technology Acquisitions Corp. Unit,$14.50,0.00,0.00%,0.00,United States,2020,6416,Health Care,Hospital/Nursing Management
DFHTW,Deerfield Healthcare Technology Acquisitions Corp. Warrant,$3.10,0.00,0.00%,0.00,United States,2020,43,Health Care,Hospital/Nursing Management
DFPH,DFP Healthcare Acquisitions Corp. Class A Common Stock,$10.00,-0.05,-0.498%,287500000.00,United States,2020,158282,Finance,Business Services
DFPHU,DFP Healthcare Acquisitions Corp. Unit,$10.65,0.24,2.305%,0.00,United States,2020,104,Finance,Business Services
DFPHW,DFP Healthcare Acquisitions Corp. Warrant,$1.32,0.00,0.00%,0.00,United States,2020,8554,Finance,Business Services
DGICA,Donegal Group Inc. Class A Common Stock,$14.55,0.13,0.902%,440512599.00,United States,,43480,Finance,Property-Casualty Insurers
DGICB,Donegal Group Inc. Class B Common Stock,$13.55,0.09,0.669%,410236819.00,United States,1986,200,Finance,Property-Casualty Insurers
DGII,Digi International Inc. Common Stock,$18.95,0.66,3.609%,629316349.00,United States,1989,316837,Technology,Computer Communications Equipment
DGLY,Digital Ally Inc. Common Stock,$1.75,0.00,0.00%,70824584.00,United States,,4560347,Technology,Radio And Television Broadcasting And Communications Equipment
DGNS,Dragoneer Growth Opportunities Corp. II Class A Ordinary Shares,$10.10,0.00,0.00%,318958000.00,United States,2020,268977,Finance,Business Services
DGNU,Dragoneer Growth Opportunities Corp. III Class A Ordinary Shares,$10.01,0.00,0.00%,500500000.00,United States,2021,2550194,Finance,Business Services
DHBCU,DHB Capital Corp. Unit,$9.83,-0.05,-0.506%,0.00,United States,2021,19505,Finance,Business Services
DHC,Diversified Healthcare Trust Common Shares of Beneficial Interest,$4.77,0.09,1.923%,1136540640.00,United States,,1483247,Consumer Services,Real Estate Investment Trusts
DHCAU,DHC Acquisition Corp. Unit,$9.85,0.02,0.203%,0.00,United States,2021,12465,Finance,Business Services
DHCNI,Diversified Healthcare Trust 5.625% Senior Notes due 2042,$23.0992,0.0992,0.431%,0.00,United States,,31208,Consumer Services,Real Estate Investment Trusts
DHCNL,Diversified Healthcare Trust 6.25% Senior Notes Due 2046,$23.81,0.20,0.847%,0.00,United States,,15378,Consumer Services,Real Estate Investment Trusts
DHHCU,DiamondHead Holdings Corp. Unit,$9.83,0.00,0.00%,0.00,United States,2021,344898,Finance,Business Services
DHHCW,DiamondHead Holdings Corp. Warrant,$0.59,-0.16,-21.333%,0.00,United States,2021,55295,Finance,Business Services
DHIL,Diamond Hill Investment Group Inc. Class A Common Stock,$159.00,0.36,0.227%,502443021.00,United States,,8804,Finance,Investment Managers
DIOD,Diodes Incorporated Common Stock,$78.01,0.23,0.296%,3454542729.00,United States,,381443,Technology,Semiconductors
DISAU,Disruptive Acquisition Corporation I Unit,$9.83,-0.01,-0.102%,0.00,United States,2021,1131764,,
DISCA,Discovery Inc. Series A Common Stock,$57.75,-4.19,-6.765%,28143549761.00,United States,,13589312,Consumer Services,Television Services
DISCB,Discovery Inc. Series B Common Stock,$61.21,-4.29,-6.55%,29829726076.00,United States,,3517,Consumer Services,Television Services
DISCK,Discovery Inc. Series C Common Stock,$51.04,-3.50,-6.417%,24873537313.00,United States,,8451386,Consumer Services,Television Services
DISH,DISH Network Corporation Class A Common Stock,$36.25,0.73,2.055%,19074494619.00,United States,1995,3324209,Consumer Services,Television Services
DJCO,Daily Journal Corp. (S.C.) Common Stock,$319.77,6.17,1.967%,441521148.00,United States,,1958,Consumer Services,Newspapers/Magazines
DKNG,DraftKings Inc. Class A Common Stock,$65.86,-0.77,-1.156%,26192850576.00,United States,2019,18309565,Consumer Services,Services-Misc. Amusement & Recreation
DLCA,Deep Lake Capital Acquisition Corp. Class A Ordinary Shares,$9.69,-0.05,-0.513%,250728750.00,United States,2021,214606,Finance,Business Services
DLCAU,Deep Lake Capital Acquisition Corp. Unit,$9.96,-0.07,-0.698%,0.00,United States,2021,302386,Finance,Business Services
DLCAW,Deep Lake Capital Acquisition Corp. Warrant,$0.5802,-0.0898,-13.403%,0.00,United States,2021,110875,Finance,Business Services
DLHC,DLH Holdings Corp.,$10.05,-0.19,-1.855%,126066255.00,United States,,28669,Technology,Professional Services
DLPN,Dolphin Entertainment Inc. Common Stock,$17.82,-1.34,-6.994%,116905294.00,United States,,14888528,Consumer Services,Other Consumer Services
DLTH,Duluth Holdings Inc. Class B Common Stock,$15.98,0.98,6.533%,524594572.00,United States,2015,389583,Consumer Services,Clothing/Shoe/Accessory Stores
DLTR,Dollar Tree Inc. Common Stock,$111.08,0.58,0.525%,25928396349.00,United States,1995,1221283,Consumer Services,Department/Specialty Retail Stores
DMAC,DiaMedica Therapeutics Inc. Common Stock,$9.79,-0.16,-1.608%,183455534.00,United States,2018,86812,Health Care,Major Pharmaceuticals
DMLP,Dorchester Minerals L.P. Common Units Representing Limited Partnership Interests,$13.90,-0.03,-0.215%,482048859.00,United States,,24533,Energy,Oil & Gas Production
DMRC,Digimarc Corporation Common Stock,$33.14,-0.71,-2.097%,558295959.00,United States,,110216,Technology,EDP Services
DMTK,DermTech Inc. Common Stock,$50.17,-1.50,-2.903%,1442671864.00,United States,2017,2304024,Health Care,Medical Specialities
DNLI,Denali Therapeutics Inc. Common Stock,$55.60,1.01,1.85%,6726715126.00,United States,2017,554975,Health Care,Biotechnology: Biological Products (No Diagnostic Substances)
DOCU,DocuSign Inc. Common Stock,$200.29,1.83,0.922%,38306848106.00,United States,2018,3427920,Technology,Computer Software: Prepackaged Software
DOGZ,Dogness (International) Corporation Class A Common Stock,$1.75,0.04,2.339%,51395332.00,China,2017,187170,Consumer Durables,Miscellaneous manufacturing industries
DOMO,Domo Inc. Class B Common Stock,$59.12,1.97,3.447%,1770600665.00,United States,2018,625953,Technology,Computer Software: Prepackaged Software
DOOO,BRP Inc. (Recreational Products) Common Subordinate Voting Shares,$81.09,2.39,3.037%,7129443342.00,Canada,,256600,Capital Goods,Industrial Specialties
DORM,Dorman Products Inc. Common Stock,$102.93,1.51,1.489%,3311983859.00,United States,,105140,Capital Goods,Auto Parts:O.E.M.
DOX,Amdocs Limited Ordinary Shares,$80.21,1.44,1.828%,10493473250.00,Guernsey,,710207,Technology,EDP Services
DOYU,DouYu International Holdings Limited ADS,$11.26,-0.38,-3.265%,3613858153.00,China,2019,2057344,Technology,Computer Software: Programming Data Processing
DRIO,DarioHealth Corp. Common Stock,$20.74,0.95,4.80%,316770088.00,Israel,,263311,Health Care,Medical/Dental Instruments
DRNA,Dicerna Pharmaceuticals Inc. Common Stock,$23.97,1.06,4.627%,1829411805.00,United States,2014,1012876,Health Care,Major Pharmaceuticals
DRRX,DURECT Corporation Common Stock,$2.02,0.07,3.59%,458947763.00,United States,2000,1097840,Health Care,Major Pharmaceuticals
DRTT,DIRTT Environmental Solutions Ltd. Common Shares,$3.12,-0.16,-4.878%,264205856.00,Canada,,179492,Technology,Computer Software: Prepackaged Software
DRVN,Driven Brands Holdings Inc. Common Stock,$22.79,-1.16,-4.843%,3815279666.00,United States,2021,424412,Consumer Services,Automotive Aftermarket
DSAC,Duddell Street Acquisition Corp. Class A Ordinary Shares,$9.81,-0.01,-0.102%,214593750.00,Hong Kong,2020,53690,Finance,Business Services
DSACU,Duddell Street Acquisition Corp. Unit,$11.00,0.01,0.091%,0.00,Hong Kong,2020,2500,Finance,Business Services
DSACW,Duddell Street Acquisition Corp. Warrant,$1.5199,-0.0202,-1.312%,0.00,Hong Kong,2020,21167,Finance,Business Services
DSEY,Diversey Holdings Ltd. Ordinary Shares,$14.98,-0.02,-0.133%,0.00,United States,,16136700,,
DSGX,Descartes Systems Group Inc. (The) Common Stock,$58.99,-0.91,-1.519%,4984499148.00,Canada,,78391,Technology,Computer Software: Prepackaged Software
DSKE,Daseke Inc. Common Stock,$7.70,0.74,10.632%,500721991.00,United States,2015,723541,Consumer Services,Transportation Services
DSKEW,Daseke Inc. Warrant,$0.24,-0.0097,-3.885%,0.00,United States,2015,243912,Consumer Services,Transportation Services
DSP,Viant Technology Inc. Class A Common Stock,$46.11,-1.18,-2.495%,2717518625.00,United States,2021,344543,Technology,Computer Software: Programming Data Processing
DSPG,DSP Group Inc. Common Stock,$14.00,-0.21,-1.478%,339164126.00,United States,1994,127349,Technology,Semiconductors
DSWL,Deswell Industries Inc. Common Shares,$3.57,-0.08,-2.192%,56817403.00,Macau,1995,17383,Consumer Non-Durables,Plastic Products
DTEA,DAVIDsTEA Inc. Common Stock,$3.41,-0.20,-5.54%,89447393.00,Canada,2015,234827,Consumer Non-Durables,Food Chains
DTIL,Precision BioSciences Inc. Common Stock,$10.20,0.85,9.091%,581259118.00,United States,2019,804416,Health Care,Biotechnology: Biological Products (No Diagnostic Substances)
DTOCU,Digital Transformation Opportunities Corp. Units,$9.84,-0.03,-0.304%,0.00,United States,2021,10021,Finance,Business Services
DTSS,Datasea Inc. Common Stock,$3.69,0.13,3.652%,79225946.00,China,,113986,Technology,Computer Software: Prepackaged Software
DUNE,Dune Acquisition Corporation Class A Common Stock,$9.70,0.04,0.414%,,United States,2021,56131,Finance,Business Services
DUNEU,Dune Acquisition Corporation Unit,$9.94,0.00,0.00%,0.00,United States,2020,37855,Finance,Business Services
DUNEW,Dune Acquisition Corporation Warrant,$0.63,-0.02,-3.077%,0.00,United States,2021,94360,Finance,Business Services
DUO,Fangdd Network Group Ltd. American Depositary Shares,$6.92,0.15,2.216%,552539607.00,China,2019,58142,Finance,Real Estate
DUOT,Duos Technologies Group Inc. Common Stock,$8.63,-0.85,-8.966%,30498549.00,United States,,49009,Technology,Computer Software: Prepackaged Software
DVAX,Dynavax Technologies Corporation Common Stock,$10.28,0.67,6.972%,1164272718.00,United States,2004,2873519,Health Care,Major Pharmaceuticals
DWSN,Dawson Geophysical Company Common Stock,$2.50,-0.06,-2.344%,58695180.00,United States,,86629,Energy,Oil & Gas Production
DXCM,DexCom Inc. Common Stock,$348.19,-7.54,-2.12%,33487996023.00,United States,2005,881744,Health Care,Medical/Dental Instruments
DXPE,DXP Enterprises Inc. Common Stock,$30.24,1.10,3.775%,583428787.00,United States,,144576,Capital Goods,Industrial Machinery/Components
DXYN,Dixie Group Inc. (The) Common Stock,$3.45,0.05,1.471%,53260231.00,United States,,63227,Consumer Durables,Home Furnishings
DYAI,Dyadic International Inc. Common Stock,$5.14,-0.30,-5.515%,141258287.00,United States,,366515,Health Care,Biotechnology: Biological Products (No Diagnostic Substances)
DYN,Dyne Therapeutics Inc. Common Stock,$14.68,0.68,4.857%,755240536.00,United States,2020,158685,Health Care,Major Pharmaceuticals
DYNT,Dynatronics Corporation Common Stock,$1.16,0.07,6.422%,17370429.00,United States,,189375,Health Care,Medical/Dental Instruments
DZSI,DZS Inc. Common Stock,$15.20,-0.05,-0.328%,407971420.00,United States,,107543,Public Utilities,Telecommunications Equipment
EA,Electronic Arts Inc. Common Stock,$130.03,0.23,0.177%,37400012291.00,United States,,1956573,Technology,Computer Software: Prepackaged Software
EAC,Edify Acquisition Corp. Class A Common Stock,$9.65,-0.01,-0.104%,332925000.00,United States,2021,50061,Finance,Business Services
EACPU,Edify Acquisition Corp. Units,$9.87,0.04,0.407%,0.00,United States,2021,20113,Finance,Business Services
EACPW,Edify Acquisition Corp. Warrant,$0.50,0.005,1.01%,0.00,United States,2021,52300,Finance,Business Services
EAR,Eargo Inc. Common Stock,$52.37,1.80,3.559%,2005531250.00,United States,2020,253564,Health Care,Industrial Specialties
EARS,Auris Medical Holding Ltd. Common Shares 0.01 SF (Bermuda),$3.41,-0.07,-2.011%,24175236.00,Bermuda,2014,770001,Health Care,Major Pharmaceuticals
EAST,Eastside Distilling Inc. Common Stock,$1.80,0.03,1.695%,20428654.00,United States,,61960,Consumer Non-Durables,Beverages (Production/Distribution)
EBACU,European Biotech Acquisition Corp. Units,$10.00,0.19,1.937%,0.00,Netherlands,2021,95872,Finance,Business Services
EBAY,eBay Inc. Common Stock,$58.09,0.45,0.781%,39527094605.00,United States,1998,5705484,Miscellaneous,Business Services
EBC,Eastern Bankshares Inc. Common Stock,$18.97,0.14,0.743%,3542802181.00,United States,2020,555155,Finance,Savings Institutions
EBIX,Ebix Inc. Common Stock,$31.21,2.25,7.769%,966341466.00,United States,,489382,Technology,EDP Services
EBMT,Eagle Bancorp Montana Inc. Common Stock,$24.64,0.64,2.667%,166947014.00,United States,,32194,Finance,Major Banks
EBON,Ebang International Holdings Inc. Class A Ordinary Shares,$7.74,-0.02,-0.258%,1330005508.00,China,2020,16276573,Technology,Semiconductors
EBSB,Meridian Bancorp Inc. Common Stock,$18.51,0.45,2.492%,970250979.00,United States,,104448,Finance,Major Banks
EBTC,Enterprise Bancorp Inc Common Stock,$32.43,0.67,2.11%,387795573.00,United States,,9609,Finance,Major Banks
ECHO,Echo Global Logistics Inc. Common Stock,$30.14,0.87,2.972%,801968767.00,United States,2009,220486,Transportation,Oil Refining/Marketing
ECOL,US Ecology Inc Common Stock,$41.29,0.87,2.152%,1300615841.00,United States,,133798,Public Utilities,Environmental Services
ECOLW,US Ecology Inc. Warrant,$10.45,0.00,0.00%,0.00,United States,,20,Public Utilities,Environmental Services
ECOR,electroCore Inc. Common Stock,$2.09,0.01,0.481%,101316481.00,United States,2018,752304,Health Care,Biotechnology: Electromedical & Electrotherapeutic Apparatus
ECPG,Encore Capital Group Inc Common Stock,$40.25,0.31,0.776%,1261659152.00,United States,,454736,Finance,Finance Companies
EDAP,EDAP TMS S.A. American Depositary Shares,$7.79,0.28,3.728%,227012799.00,France,1997,75861,Health Care,Biotechnology: Electromedical & Electrotherapeutic Apparatus
EDIT,Editas Medicine Inc. Common Stock,$42.18,1.19,2.903%,2841362524.00,United States,2016,2255140,Health Care,Biotechnology: Biological Products (No Diagnostic Substances)
EDRY,EuroDry Ltd. Common Shares ,$8.74,0.41,4.922%,20142466.00,Greece,,44205,Consumer Services,Marine Transportation
EDSA,Edesa Biotech Inc. Common Shares,$5.15,0.25,5.102%,67868976.00,United States,,361841,Health Care,Major Pharmaceuticals
EDTK,Skillful Craftsman Education Technology Limited Ordinary Share,$3.32,-0.18,-5.143%,39840000.00,China,2020,237706,Consumer Services,Other Consumer Services
EDTX,EdtechX Holdings Acquisition Corp. II Class A common stock,$9.78,0.04,0.411%,77323125.00,United Kingdom,2021,2379,Finance,Business Services
EDTXU,EdtechX Holdings Acquisition Corp. II Unit,$9.92,-0.12,-1.195%,142600000.00,United Kingdom,2020,2275,Finance,Business Services
EDTXW,EdtechX Holdings Acquisition Corp. II Warrant,$0.54,-0.04,-6.897%,0.00,United Kingdom,2021,3047,Finance,Business Services
EDUC,Educational Development Corporation Common Stock,$16.77,-0.12,-0.71%,140045800.00,United States,,25650,Consumer Durables,Consumer Specialties
EEFT,Euronet Worldwide Inc. Common Stock,$139.54,0.02,0.014%,7361132829.00,United States,1997,488321,Finance,Investment Bankers/Brokers/Service
EEIQ,Elite Education Group International Ltd. Common Stock,$4.00,-4.00,-50.00%,0.00,United States,,325224,,
EFOI,Energy Focus Inc. Common Stock,$4.37,0.435,11.055%,18310326.00,United States,,157309,Consumer Durables,Building Products
EFSC,Enterprise Financial Services Corporation Common Stock,$48.89,1.44,3.035%,1528069613.00,United States,,133352,Finance,Major Banks
EGAN,eGain Corporation Common Stock,$9.18,0.06,0.658%,285085047.00,United States,1999,225026,Technology,Computer Software: Prepackaged Software
