Symbol,Name,Last Sale,Net Change,% Change,Market Cap,Country,IPO Year,Volume,Sector,Industry
INFO,IHS Markit Ltd. Common Shares,$109.34,0.84,0.774%,46332194436.00,Bermuda,1996,2821888,,
INFY,Infosys Limited American Depositary Shares,$18.11,-0.09,-0.495%,76881882385.00,India,,4087688,,
ING,ING Group N.V. Common Stock,$12.80,-0.10,-0.775%,49928558528.00,Netherlands,1997,5090122,,
INGR,Ingredion Incorporated Common Stock,$93.67,-0.79,-0.836%,6297253879.00,United States,,845276,,
INN,Summit Hotel Properties Inc. Common Stock,$10.14,-0.26,-2.50%,1071887100.00,United States,2011,535085,,
INN^D,Summit Hotel Properties Inc. 6.45% Series D Cumulative Redeemable Preferred Stock,$25.63,-0.025,-0.097%,,United States,,8667,,
INN^E,Summit Hotel Properties Inc. 6.250% Series E Cumulative Redeemable Preferred Stock,$26.26,-0.18,-0.681%,,United States,,26986,,
INSI,Insight Select Income Fund,$20.56,-0.0519,-0.252%,220198320.00,United States,,11898,,
INSP,Inspire Medical Systems Inc. Common Stock,$226.53,-8.95,-3.801%,6322471782.00,United States,1998,247734,,
INSW,International Seaways Inc. Common Stock ,$18.57,-0.06,-0.322%,521575794.00,,2016,228049,,
INSW^A,International Seaways Inc. 8.50% Senior Notes due June 30 2023,$25.7506,-0.0694,-0.269%,,,,1686,,
INT,World Fuel Services Corporation Common Stock,$32.38,-0.38,-1.16%,2046633723.00,United States,,257885,,
INVH,Invitation Homes Inc. Common Stock,$34.86,0.12,0.345%,19788294129.00,United States,2017,3012113,,
IO,Ion Geophysical Corporation Common Stock,$2.24,0.06,2.752%,64537104.00,United States,,700435,,
IP,International Paper Company Common Stock,$60.38,1.44,2.443%,23719359367.00,United States,,2513668,,
IPG,Interpublic Group of Companies Inc. (The) Common Stock,$32.58,0.51,1.59%,12816178612.00,United States,,3597933,,
IPI,Intrepid Potash Inc Common Stock,$35.62,1.93,5.729%,479162413.00,United States,2008,337533,,
IPOD,Social Capital Hedosophia Holdings Corp. IV Class A Ordinary Shares,$10.64,0.01,0.094%,611800000.00,United States,2020,518775,,
IPOE,Social Capital Hedosophia Holdings Corp. V Class A Ordinary Shares,$16.17,-0.20,-1.222%,1627106250.00,United States,2020,1985775,,
IPOF,Social Capital Hedosophia Holdings Corp. VI Class A Ordinary Shares,$10.43,0.02,0.192%,1499312500.00,United States,2020,1713729,,
IPVA,InterPrivate II Acquisition Corp. Class A Common Stock,$9.70,-0.22,-2.218%,313734375.00,,2021,498,,
IPVF,InterPrivate III Financial Partners Inc. Class A Common Stock,$9.74,0.00,0.00%,315028125.00,,2021,2081,,
IQI,Invesco Quality Municipal Income Trust Common Stock,$13.30,0.17,1.295%,703354500.00,United States,,69327,,
IQV,IQVIA Holdings Inc. Common Stock,$232.69,-1.27,-0.543%,44597638578.00,United States,2013,1069202,,
IR,Ingersoll Rand Inc. Common Stock,$49.21,0.91,1.884%,123768232015.00,United States,2017,1974393,,
IRL,New Ireland Fund Inc (The) Common Stock,$13.21,-0.15,-1.123%,64110798.00,United States,1990,12370,,
IRM,Iron Mountain Incorporated (Delaware)Common Stock REIT,$39.87,-0.23,-0.574%,11510994447.00,United States,,1590384,,
IRR,Voya Natural Resources Equity Income Fund Common Shares of Beneficial Interest,$3.42,-0.06,-1.724%,76429784.00,United States,,104622,,
IRS,IRSA Inversiones Y Representaciones S.A. Common Stock,$3.89,-0.04,-1.018%,227032941.00,Argentina,,64357,,
IRT,Independence Realty Trust Inc. Common Stock,$16.26,-0.39,-2.342%,1659128482.00,United States,2013,817009,,
ISD,PGIM High Yield Bond Fund Inc.,$16.05,-0.08,-0.496%,533770436.00,United States,2012,137656,,
ISOS,Isos Acquisition Corporation Class A Ordinary Shares,$9.75,-0.07,-0.713%,0.00,,2021,1005,,
IT,Gartner Inc. Common Stock,$225.49,28.08,14.224%,19609630291.00,United States,1993,2727175,,
ITCB,Itau CorpBanca American Depositary Shares (each representing 1500 shares of Common Stock no par value),$5.47,0.17,3.208%,1868576648.00,Chile,,13595,,
ITGR,Integer Holdings Corporation Common Stock,$93.38,-1.24,-1.311%,3079163386.00,United States,,108394,,
ITT,ITT Inc. Common Stock ,$95.66,1.89,2.016%,8231921622.00,United States,2011,429800,,
ITUB,Itau Unibanco Banco Holding SA American Depositary Shares (Each repstg 500 Preferred shares),$4.90,-0.17,-3.353%,47836038790.00,Brazil,,47977704,,
ITW,Illinois Tool Works Inc. Common Stock,$235.98,2.42,1.036%,74683013407.00,United States,,1146492,,
IVAN,Ivanhoe Capital Acquisition Corp. Class A Ordinary Shares,$10.00,0.0001,0.001%,345000000.00,,2021,46018,,
IVC,Invacare Corporation Common Stock,$8.94,-0.06,-0.667%,311312050.00,United States,,735522,,
IVH,Ivy High Income Opportunities Fund Common Shares of Beneficial Interest,$13.97,0.06,0.431%,231486183.00,,2013,139621,,
IVR,INVESCO MORTGAGE CAPITAL INC Common Stock,$3.83,-0.07,-1.795%,884146729.00,United States,2009,5821084,,
IVR^A,Invesco Mortgage Capital Inc. Pfd Ser A,$24.82,-0.09,-0.361%,,United States,,19852,,
IVR^B,Invesco Mortgage Capital Inc. Preferred Series B Cum Fxd to Fltg,$24.77,0.06,0.243%,,United States,,4950,,
IVR^C,INVESCO MORTGAGE CAPITAL INC 7.5% Fixed-to-Floating Series C Cumulative Redeemable Preferred Stock Liquation Preference $25.00 per Share,$24.00,-0.11,-0.456%,,United States,,27256,,
IVZ,Invesco Ltd Common Stock,$27.54,0.12,0.438%,12703652715.00,United States,,3620060,,
IX,Orix Corp Ads Common Stock,$80.75,-0.45,-0.554%,19694805813.00,Japan,,16480,,
J,Jacobs Engineering Group Inc. Common Stock,$138.26,2.52,1.856%,17985712620.00,United States,,528232,,
JAX,J. Alexander's Holdings Inc. Common Stock,$10.70,0.24,2.294%,161463824.00,,2015,40791,,
JBGS,JBG SMITH Properties Common Shares ,$32.00,-0.07,-0.218%,4207102624.00,United States,2017,596376,,
JBL,Jabil Inc. Common Stock,$51.93,-0.67,-1.274%,7727078219.00,United States,1993,919929,,
JBT,John Bean Technologies Corporation Common Stock,$142.84,-0.26,-0.182%,4532342625.00,United States,,107003,,
JCE,Nuveen Core Equity Alpha Fund Nuveen Core Equity Alpha Fund Common Shares of Beneficial Interest,$16.03,-0.16,-0.988%,256949374.00,United States,2007,72253,,
JCI,Johnson Controls International plc Ordinary Share,$63.64,-0.25,-0.391%,45611748391.00,Switzerland,,6186657,,
JCO,Nuveen Credit Opportunities 2022 Target Term Fund Common Shares of Beneficial Interest,$8.66,-0.01,-0.115%,240319261.00,United States,2017,51491,,
JDD,Nuveen Diversified Dividend and Income Fund Shares of Beneficial Interest,$9.90,0.14,1.434%,194718318.00,United States,2003,55406,,
JEF,Jefferies Financial Group Inc. Common Stock,$32.01,-0.71,-2.17%,7905586300.00,United States,,2287770,,
JELD,JELD-WEN Holding Inc. Common Stock,$29.23,-1.02,-3.372%,2924047925.00,United States,2017,602848,,
JEMD,Nuveen Emerging Markets Debt 2022 Target Term Fund Common Shares of Beneficial Interest $0.01 par value per share,$8.1863,0.0063,0.077%,116630151.00,,2017,68200,,
JEQ,Aberdeen Japan Equity Fund Inc.  Common Stock,$8.83,-0.13,-1.451%,118397373.00,United States,1992,9351,,
JFR,Nuveen Floating Rate Income Fund Common Stock,$9.70,0.03,0.31%,552109140.00,United States,2004,295286,,
JGH,Nuveen Global High Income Fund Common Shares of Beneficial Interest,$15.86,0.00,0.00%,367593453.00,United States,2014,38103,,
JHAA,Nuveen Corporate Income 2023 Target Term Fund,$10.10,0.06,0.598%,79037136.00,,2018,23386,,
JHB,Nuveen Corporate Income November 2021 Target Term Fund,$9.40,0.00,0.00%,525460461.00,,2016,136647,,
JHG,Janus Henderson Group plc Ordinary Shares,$36.05,1.21,3.473%,6213217103.00,,2017,1068566,,
JHI,John Hancock Investors Trust Common Stock,$18.415,0.0744,0.406%,160339865.00,United States,,7514,,
JHS,John Hancock Income Securities Trust Common Stock,$15.818,0.158,1.009%,184225666.00,United States,,17493,,
JHX,James Hardie Industries plc American Depositary Shares (Ireland),$33.31,0.67,2.053%,14795219059.00,Ireland,,81827,,
JIH,Juniper Industrial Holdings Inc. Class A Common Stock,$12.98,-0.12,-0.916%,559762500.00,,2019,260939,,
JILL,J. Jill Inc. Common Stock,$9.38,0.25,2.738%,91054690.00,,2017,61705,,
JKS,JinkoSolar Holding Company Limited American Depositary Shares (each representing 4 Common Shares),$34.16,-2.73,-7.40%,1628712180.00,China,2010,1555561,,
JLL,Jones Lang LaSalle Incorporated Common Stock,$191.04,-0.41,-0.214%,9801536448.00,United States,,331770,,
JLS,Nuveen Mortgage and Income Fund,$21.175,-0.015,-0.071%,116196542.00,United States,2009,8397,,
JMIA,Jumia Technologies AG American Depositary Shares each representing two Ordinary Shares,$26.99,-4.25,-13.604%,2661013842.00,,2019,12809708,,
JMM,Nuveen Multi-Market Income Fund (MA),$7.3667,0.0667,0.914%,69706301.00,United States,,315,,
JMP,JMP Group LLC Common Shares,$5.09,-0.27,-5.037%,100900872.00,United States,2007,140938,,
JNJ,Johnson & Johnson Common Stock,$167.77,2.56,1.55%,441804847423.00,United States,,10179539,,
JNPR,Juniper Networks Inc. Common Stock,$26.09,0.22,0.85%,8550739731.00,United States,1999,5593283,,
JOE,St. Joe Company (The) Common Stock,$45.01,-0.90,-1.96%,2650303530.00,United States,,150436,,
JOF,Japan Smaller Capitalization Fund Inc Common Stock,$9.08,-0.09,-0.981%,257271748.00,United States,1990,33060,,
JP,Jupai Holdings Limited American Depositary Shares each representing six ordinary shares,$2.05,-0.03,-1.442%,68111607.00,,2015,13391,,
JPC,Nuveen Preferred & Income Opportunities Fund,$9.78,0.01,0.102%,1010813357.00,United States,2003,311811,,
JPI,Nuveen Preferred and Income Term Fund Common Shares of Beneficial Interest,$25.51,0.03,0.118%,580643084.00,,2012,30137,,
JPM,JP Morgan Chase & Co. Common Stock,$155.48,2.12,1.382%,470653508000.00,United States,,12977673,,
JPM^C,J P Morgan Chase & Co Depositary Shares each representing a 1/400th interest in a share of 6.00% Non-Cumulative  Preferred Stock Series EE,$27.78,0.04,0.144%,,United States,,99126,,
JPM^D,J P Morgan Chase & Co Depositary Shares each representing a 1/400th  interest in a share of 5.75% Non-Cumulative  Preferred Stock Series DD,$27.28,0.00,0.00%,,United States,,76704,,
JPM^G,J P Morgan Chase & Co Depositary Shares each representing a 1/400th interest in a share of 6.10% Non-Cumulative Preferred Stock Series AA,$25.00,-0.02,-0.08%,,United States,,304080,,
JPM^H,J P Morgan Chase & Co Depositary Shares each representing a 1/400th interest in a share of 6.15% Non-Cumulative Preferred Stock Series BB,$25.00,-0.02,-0.08%,,United States,,185591,,
JPM^J,J P Morgan Chase & Co Depositary Shares each representing a 1/400th interest in a share of JPMorgan Chase & Co. 4.75% Non-Cumulative Preferred Stock Series GG,$26.42,0.06,0.228%,,United States,,59425,,
JPM^K,J P Morgan Chase & Co Depositary Shares each representing a 1/400th interest in a share of 4.55% Non-Cumulative Preferred Stock Series JJ,$26.34,0.14,0.534%,,United States,,336521,,
JPS,Nuveen Preferred & Income Securities Fund,$9.87,-0.04,-0.404%,2011408751.00,United States,2002,340855,,
JPT,Nuveen Preferred and Income 2022 Term Fund Common Shares of Beneficial Interest,$24.78,-0.09,-0.362%,169521764.00,United States,2017,9430,,
JQC,Nuveen Credit Strategies Income Fund Shares of Beneficial Interest,$6.66,0.00,0.00%,903157871.00,United States,2003,975410,,
JRI,Nuveen Real Asset Income and Growth Fund Common Shares of Beneficial Interest,$15.58,0.09,0.581%,427728334.00,United States,2012,126097,,
JRO,Nuveen Floating Rate Income Opportuntiy Fund Shares of Beneficial Interest,$9.55,0.02,0.21%,387168632.00,United States,2004,110556,,
JRS,Nuveen Real Estate Income Fund Common Shares of Beneficial Interest,$10.40,0.00,0.00%,300481698.00,United States,2001,87778,,
JSD,Nuveen Short Duration Credit Opportunities Fund Common Shares of Beneficial Interest,$14.39,0.03,0.209%,145132475.00,United States,2011,32950,,
JT,Jianpu Technology Inc. American depositary shares,$2.88,0.06,2.128%,60866456.00,,2017,117481,,
JTA,Nuveen Tax-Advantaged Total Return Strategy Fund Common Share of Beneficial Interest,$11.02,-0.02,-0.181%,152636885.00,United States,2004,45710,,
JTD,Nuveen Tax-Advantaged Dividend Growth Fund Common Shares of Beneficial Interest,$15.54,-0.11,-0.703%,225086644.00,United States,,72895,,
JW/A,John Wiley & Sons Inc.,$60.11,0.73,1.229%,,United States,,401865,,
JW/B,John Wiley & Sons Inc.,$59.51,0.00,0.00%,,United States,,3,,
JWN,Nordstrom Inc. Common Stock,$38.20,-0.68,-1.749%,6026828516.00,United States,,2679318,,
JWS,Jaws Acquisition Corp. Class A Ordinary Shares,$13.00,0.04,0.309%,1121250000.00,,2020,384623,,
JWSM,Jaws Mustang Acquisition Corp. Class A Ordinary Shares,$9.94,0.02,0.202%,1285987500.00,,2021,164739,,
K,Kellogg Company Common Stock,$62.48,-0.41,-0.652%,21265405392.00,United States,,2628961,,
KAI,Kadant Inc Common Stock,$180.02,1.00,0.559%,2084231956.00,United States,,34779,,
KAMN,Kaman Corporation Common Stock,$53.25,0.02,0.038%,1476683951.00,United States,,156207,,
KAR,KAR Auction Services Inc Common Stock,$14.51,-0.39,-2.617%,1810283561.00,United States,2009,5093695,,
KB,KB Financial Group Inc,$47.59,-0.65,-1.347%,18542698003.00,South Korea,,184254,,
KBH,KB Home Common Stock,$49.59,0.04,0.081%,4896402047.00,United States,1986,745812,,
KBR,KBR Inc. Common Stock,$39.83,0.08,0.201%,5629819106.00,United States,2006,1302441,,
KCAC,Kensington Capital Acquisition Corp. II Class A Common Stock,$10.14,-0.0192,-0.189%,0.00,,2021,68091,,
KEN,Kenon Holdings Ltd. Ordinary Shares,$33.07,-0.51,-1.519%,1781782399.00,Singapore,2015,7593,,
KEP,Korea Electric Power Corporation Common Stock,$10.40,-0.11,-1.047%,13352852802.00,South Korea,1994,133633,,
KEX,Kirby Corporation Common Stock,$65.63,-0.31,-0.47%,3943448380.00,United States,,490352,,
KEY,KeyCorp Common Stock,$22.40,0.40,1.818%,21785948800.00,United States,,11013156,,
KEY^I,KeyCorp Depositary Shares Each Representing a 1/40th Ownership Interest in a Share of Fixed-to-Floating Rate Perpetual Non-Cumulative Preferred Stock Series E,$29.76,-0.42,-1.392%,,United States,,139080,,
KEY^J,KeyCorp Depositary Shares each representing a 1/40th ownership interest in a share of Fixed Rate Perpetual Non-Cumulative Preferred Stock Series F,$27.15,-0.09,-0.33%,,United States,,21541,,
KEY^K,KeyCorp Depositary Shares each representing a 1/40th ownership interest in a share of Fixed Rate Perpetual Non-Cumulative Preferred Stock Series G,$27.64,-0.13,-0.468%,,United States,,32276,,
KEYS,Keysight Technologies Inc. Common Stock,$140.32,-0.08,-0.057%,26098738698.00,United States,2014,1028925,,
KF,Korea Fund Inc. (The) New Common Stock,$43.33,-0.96,-2.168%,217515560.00,United States,,5124,,
KFS,Kingsway Financial Services Inc. Common Stock (DE),$5.03,0.00,0.00%,114236677.00,Canada,,14891,,
KFY,Korn Ferry Common Stock,$68.37,-0.06,-0.088%,3692442797.00,United States,1999,352753,,
KGC,Kinross Gold Corporation Common Stock,$7.25,-0.12,-1.628%,9142687298.00,Canada,,12414128,,
KIM,Kimco Realty Corporation Common Stock,$21.09,0.06,0.285%,9141654570.00,United States,,4842781,,
KIM^L,Kimco Realty Corporation Class L Depositary Shares each of which represents a one-one thousandth fractional interest in a share of 5.125% Class L Cumulative Redeemable Preferred Stock liquidation preference $25000.00 per share,$26.56,0.07,0.264%,,United States,,6319,,
KIM^M,Kimco Realty Corporation Class M Depositary Shares each of which represents a one-one thousandth fractional interest in a share of 5.25% Class M Cumulative Redeemable Preferred Stock liquidation preference $25000.00 per share,$26.66,-0.08,-0.299%,,United States,,12674,,
KIO,KKR Income Opportunities Fund Common Shares,$16.10,0.03,0.187%,327479072.00,,2013,48795,,
KKR,KKR & Co. Inc. Common Stock,$55.63,-0.64,-1.137%,32076879610.00,United States,,3106617,,
KKR^A,KKR & Co. Inc. 6.75% Series A Preferred Stock,$25.61,-0.0942,-0.366%,,United States,,26303,,
KKR^B,KKR & Co. Inc. 6.50% Series B Preferred Stock,$25.67,-0.03,-0.117%,,United States,,5315,,
KKR^C,KKR & Co. Inc. 6.00% Series C Mandatory Convertible Preferred Stock,$74.71,-0.92,-1.216%,,United States,,14077,,
KKRS,KKR Group Finance Co. IX LLC 4.625% Subordinated Notes due 2061,$25.52,-0.07,-0.274%,0.00,,2021,221661,,
KL,Kirkland Lake Gold Ltd. Common Shares,$38.17,-0.55,-1.42%,10193512328.00,,,1255008,,
KMB,Kimberly-Clark Corporation Common Stock,$134.72,-0.02,-0.015%,45458783535.00,United States,,2046374,,
KMF,Kayne Anderson NextGen Energy & Infrastructure Inc.,$6.78,0.01,0.148%,319998792.00,,2010,205430,,
KMI,Kinder Morgan Inc. Common Stock,$17.17,-0.09,-0.521%,38882882950.00,United States,2011,14233050,,
KMPR,Kemper Corporation,$79.25,0.42,0.533%,5198379817.00,United States,,245779,,
KMT,Kennametal Inc. Common Stock,$41.30,0.33,0.805%,3449913024.00,United States,,1405279,,
KMX,CarMax Inc,$137.41,0.47,0.343%,22422587435.00,United States,,895036,,
KN,Knowles Corporation Common Stock,$20.65,-0.48,-2.272%,1916184743.00,,2014,1527310,,
KNL,Knoll Inc. Common Stock,$24.40,0.06,0.247%,1205022768.00,United States,2004,1191029,,
KNOP,KNOT Offshore Partners LP Common Units representing Limited Partner Interests,$18.98,-0.06,-0.315%,620533904.00,United Kingdom,2013,102646,,
KNX,Knight-Swift Transportation Holdings Inc.,$48.50,0.92,1.934%,8025702885.00,United States,2017,1210651,,
KO,Coca-Cola Company (The) Common Stock,$54.14,-0.34,-0.624%,233434391311.00,United States,,14151238,,
KODK,Eastman Kodak Company Common New,$7.16,-0.27,-3.634%,562084888.00,United States,,2883462,,
KOF,Coca Cola Femsa S.A.B. de C.V.  American Depositary Shares each representing 10 Units (each Unit consists of 3 Series B Shares and 5 Series L Shares),$46.91,-0.34,-0.72%,9855004132.00,Mexico,1993,157664,,
KOP,Koppers Holdings Inc. Koppers Holdings Inc. Common Stock,$34.97,0.82,2.401%,742616171.00,United States,2006,77762,,
KOS,Kosmos Energy Ltd. Common Shares (DE),$2.79,-0.21,-7.00%,1138454799.00,Bermuda,2011,10283260,,
KR,Kroger Company (The) Common Stock,$35.89,-1.49,-3.986%,26989053929.00,United States,,10632370,,
KRA,Kraton Corporation Common Stock,$38.01,-0.08,-0.21%,1221795226.00,United States,2009,197084,,
KRC,Kilroy Realty Corporation Common Stock,$68.34,0.42,0.618%,7958218286.00,United States,1997,1622335,,
KREF,KKR Real Estate Finance Trust Inc. Common Stock,$21.17,-0.12,-0.564%,1177463291.00,United States,2017,220569,,
KREF^A,KKR Real Estate Finance Trust Inc. 6.50% Series A Cumulative Redeemable Preferred Stock,$25.68,-0.08,-0.311%,,United States,,47919,,
KRG,Kite Realty Group Trust Common Stock,$21.18,-0.20,-0.935%,1789417335.00,United States,2004,367712,,
KRO,Kronos Worldwide Inc Common Stock,$17.56,0.11,0.63%,2028930111.00,United States,,139987,,
KRP,Kimbell Royalty Partners Common Units Representing Limited Partner Interests,$10.95,-0.17,-1.529%,657899630.00,United States,2017,93642,,
KSM,DWS Strategic Municipal Income Trust,$11.94,0.06,0.505%,133775056.00,United States,1989,19648,,
KSS,Kohl's Corporation Common Stock,$60.96,-0.86,-1.391%,9606847152.00,United States,1992,2235459,,
KSU,Kansas City Southern Common Stock,$294.14,0.64,0.218%,26747250578.00,United States,,1063809,,
KSU^,Kansas City Southern Preferred Stock,$37.985,0.715,1.918%,,United States,,400,,
KT,KT Corporation Common Stock,$12.82,0.23,1.827%,6097154668.00,South Korea,,1016673,,
KTB,Kontoor Brands Inc. Common Stock ,$64.30,-0.18,-0.279%,3689022558.00,,2019,638120,,
KTF,DWS Municipal Income Trust,$11.90,0.00,0.00%,470061162.00,United States,1988,38271,,
KTH,Structures Products Cp 8% CorTS Issued by Peco Energy Cap Tr II Preferred Stock,$33.20,0.17,0.515%,0.00,United States,,2544,,
KTN,Structured Products Corp 8.205% CorTS 8.205% Corporate Backed Trust Securities (CorTS),$32.0749,-0.1485,-0.461%,0.00,United States,,7976,,
KUKE,Kuke Music Holding Limited American Depositary Shares each representing one Ordinary Share,$4.70,-0.22,-4.472%,138963598.00,,2021,66238,,
KW,Kennedy-Wilson Holdings Inc. Common Stock,$20.79,-0.10,-0.479%,2927774390.00,United States,,381907,,
KWAC,Kingswood Acquisition Corp. Class A Common Stock,$10.05,-0.01,-0.099%,145513950.00,,2021,370,,
KWR,Quaker Chemical Corporation Common Stock,$242.08,0.49,0.203%,4333938632.00,United States,,44473,,
KYN,Kayne Anderson Energy Infrastructure Fund Inc.,$7.56,0.05,0.666%,955943508.00,United States,2004,457662,,
L,Loews Corporation Common Stock,$57.48,0.44,0.771%,15166675559.00,United States,,934092,,
LAC,Lithium Americas Corp. Common Shares,$13.48,-0.24,-1.749%,1609841384.00,Canada,,2929783,,
LAD,Lithia Motors Inc. Common Stock,$390.04,-0.18,-0.046%,10465699935.00,United States,,181779,,
LADR,Ladder Capital Corp Class A Common Stock,$11.59,-0.20,-1.696%,1464304869.00,,2014,706524,,
LAIX,LAIX Inc. American Depositary Shares each  representing one Class A Ordinary Share,$1.84,-0.06,-3.158%,90918509.00,,2018,275649,,
LAZ,Lazard LTD. Lazard LTD. Class A Common Stock,$44.94,-0.12,-0.266%,4824017474.00,Bermuda,2005,679622,,
LB,L Brands Inc.,$65.85,-1.78,-2.632%,18365423620.00,United States,,3255062,,
LBRT,Liberty Oilfield Services Inc. Class A Common Stock,$12.55,0.52,4.323%,2253238985.00,United States,2018,1551854,,
LC,LendingClub Corporation Common Stock,$14.96,-0.12,-0.796%,1454532765.00,United States,2014,2644601,,
LCI,Lannett Co Inc Common Stock,$4.54,-0.03,-0.656%,187963854.00,United States,,418406,,
LCII,LCI Industries,$150.16,1.57,1.057%,3791961649.00,United States,,172552,,
LDI,loanDepot Inc. Class A Common Stock,$18.73,-0.33,-1.731%,6087250000.00,,2021,165166,,
LDL,Lydall Inc. Common Stock,$37.83,0.72,1.94%,681658581.00,United States,,170182,,
LDOS,Leidos Holdings Inc. Common Stock,$104.80,1.10,1.061%,14813088677.00,United States,,1198621,,
LDP,Cohen & Steers Limited Duration Preferred and Income Fund Inc.,$27.72,0.22,0.80%,801770259.00,United States,2012,70507,,
LEA,Lear Corporation Common Stock,$182.85,-2.74,-1.476%,10994712902.00,United States,,281684,,
LEAF,Leaf Group Ltd. Common Stock,$8.74,0.05,0.575%,314638130.00,United States,,590298,,
LEAP,Ribbit LEAP Ltd. Class A Ordinary Shares,$10.97,-0.04,-0.363%,641799850.00,United States,2020,94631,,
LEG,Leggett & Platt Incorporated Common Stock,$53.90,3.00,5.894%,7177073958.00,United States,,1699685,,
LEJU,Leju Holdings Limited American Depositary Shares each representing one Ordinary share,$2.39,0.03,1.271%,326026124.00,,2014,63857,,
LEN,Lennar Corporation Class A Common Stock,$107.00,1.06,1.001%,33531832591.00,United States,,1834413,,
LEO,BNY Mellon Strategic Municipals Inc. Common Stock,$8.82,0.09,1.031%,548690101.00,United States,1987,145849,,
LEVI,Levi Strauss & Co Class A Common Stock,$30.10,-0.38,-1.247%,12050969343.00,United States,2019,1930323,,
LFC,China Life Insurance Company Limited American Depositary Shares,$10.06,0.02,0.199%,56868586460.00,China,2003,719949,,
LFT,Lument Finance Trust Inc. Common Stock,$3.75,-0.03,-0.794%,93537686.00,United States,2013,34689,,
LGI,Lazard Global Total Return and Income Fund Common Stock,$20.29,-0.1504,-0.736%,263966022.00,United States,2004,33817,,
LH,Laboratory Corporation of America Holdings Common Stock,$273.58,6.25,2.338%,26756124000.00,United States,,844335,,
LHC,Leo Holdings Corp. II Class A Ordinary Shares,$9.69,0.01,0.103%,454218750.00,,2021,44534,,
LHX,L3Harris Technologies Inc. Common Stock,$216.40,4.66,2.201%,44484435225.00,United States,,1742161,,
LII,Lennox International Inc. Common Stock,$341.33,1.35,0.397%,12894304968.00,United States,1999,144938,,
LIII,Leo Holdings III Corp. Class A Ordinary Shares,$9.75,-0.01,-0.102%,0.00,,2021,25000,,
LIN,Linde plc Ordinary Share,$283.00,-5.70,-1.974%,147168406515.00,,2018,2301778,,
LINX,Linx S.A. American Depositary Shares each representing one common share,$6.97,-0.06,-0.853%,1224581764.00,,2019,15269,,
LITB,LightInTheBox Holding Co. Ltd. American Depositary Shares each representing 2 ordinary shares,$2.98,-0.08,-2.614%,333091216.00,China,2013,397847,,
LL,Lumber Liquidators Holdings Inc Common Stock,$24.76,-0.30,-1.197%,717703586.00,United States,2007,843885,,
LLY,Eli Lilly and Company Common Stock,$188.20,2.28,1.226%,180574512400.00,United States,,3703540,,
LMND,Lemonade Inc. Common Stock,$83.67,-2.53,-2.935%,5135652970.00,United States,2020,2152779,,
LMT,Lockheed Martin Corporation Common Stock,$387.48,2.17,0.563%,107693860508.00,United States,,1509589,,
LNC,Lincoln National Corporation Common Stock,$64.68,0.06,0.093%,12363527604.00,United States,,941515,,
LND,Brasilagro Brazilian Agric Real Estate Co Sponsored ADR (Brazil),$6.29,-0.18,-2.782%,498060598.00,Brazil,,30120,,
LNFA,L&amp;F Acquisition Corp. Class A Ordinary Shares,$9.96,0.02,0.201%,214757520.00,United States,2021,24109,,
LNN,Lindsay Corporation Common Stock,$166.72,0.00,0.00%,1818346685.00,United States,,103574,,
LOKB,Live Oak Acquisition Corp. II Class A Common Stock,$10.18,0.01,0.098%,321942500.00,,2021,60018,,
LOKM,Live Oak Mobility Acquisition Corp. Class A Common Stock,$9.77,-0.03,-0.306%,308976250.00,,2021,15948,,
LOMA,Loma Negra Compania Industrial Argentina Sociedad Anonima ADS,$5.82,0.00,0.00%,693744000.00,Argentina,2017,129815,,
LOW,Lowe's Companies Inc. Common Stock,$200.30,1.10,0.552%,143650828513.00,United States,,4150088,,
LPG,Dorian LPG Ltd. Common Stock,$13.44,-0.56,-4.00%,557515983.00,,2014,214063,,
LPI,Laredo Petroleum Inc. Common Stock,$41.51,0.46,1.121%,535464887.00,United States,2011,362516,,
LPL,LG Display Co Ltd AMERICAN DEPOSITORY SHARES,$10.51,-0.14,-1.315%,7521286014.00,South Korea,2004,479421,,
LPX,Louisiana-Pacific Corporation Common Stock,$72.10,5.02,7.484%,7681949801.00,United States,,2863077,,
LRN,Stride Inc. Common Stock,$27.93,-0.57,-2.00%,1160267557.00,United States,,678111,,
LSI,Life Storage Inc. Common Stock,$94.50,0.17,0.18%,7222048722.00,United States,,638326,,
LSPD,Lightspeed POS Inc. Subordinate Voting Shares,$65.14,-2.67,-3.937%,8547431997.00,,,713864,,
LTC,LTC Properties Inc. Common Stock,$41.38,-1.02,-2.406%,1628908058.00,United States,,356240,,
LTHM,Livent Corporation Common Stock,$18.08,0.36,2.032%,2650640801.00,United States,2018,2303683,,
