Symbol,Name,Last Sale,Net Change,% Change,Market Cap,Country,IPO Year,Volume,Sector,Industry
PEAK,Healthpeak Properties Inc. Common Stock,$34.03,-0.12,-0.351%,18337847680.00,United States,,2677598,,
PEB,Pebblebrook Hotel Trust Common Shares of Beneficial Interest,$23.54,-0.56,-2.324%,3092808973.00,United States,2009,1517401,,
PEB^C,Pebblebrook Hotel Trust 6.50% Series C Cumulative Redeemable Preferred Shares of Beneficial Interest,$25.25,-0.01,-0.04%,,United States,,12927,,
PEB^D,Pebblebrook Hotel Trust 6.375% Series D Cumulative Redeemable Preferred Shares of Beneficial Interest,$25.32,0.04,0.158%,,United States,,6520,,
PEB^E,Pebblebrook Hotel Trust 6.375% Series E Cumulative Redeemable Preferred Shares of Beneficial Interest,$25.25,-0.04,-0.158%,,United States,,13593,,
PEB^F,Pebblebrook Hotel Trust 6.3% Series F Cumulative Redeemable Preferred Shares of Beneficial Interest,$25.10,-0.0337,-0.134%,,United States,,6970,,
PEG,Public Service Enterprise Group Incorporated Common Stock,$63.19,-0.46,-0.723%,31916832294.00,United States,,2424108,,
PEI,Pennsylvania Real Estate Investment Trust Common Stock,$1.97,-0.06,-2.956%,156142027.00,United States,,831623,,
PEI^B,Pennsylvania Real Estate Investment Trust Cumulative Redeemable Perpetual Preferred Shares Series B,$10.05,0.15,1.515%,,United States,,15203,,
PEI^C,Pennsylvania Real Estate Investment Trust 7.20% Series C Cumulative Redeemable Perpetual Preferred Shares,$10.20,0.42,4.294%,,United States,,14449,,
PEI^D,Pennsylvania Real Estate Investment Trust 6.875% Series D Cumulative Redeemable Perpetual Preferred Shares,$10.38,0.37,3.696%,,United States,,10066,,
PEN,Penumbra Inc. Common Stock,$288.93,-9.17,-3.076%,10540847408.00,,2015,264477,,
PEO,Adams Natural Resources Fund Inc. Common Stock,$15.41,-0.17,-1.091%,371049022.00,United States,,118875,,
PFD,Flaherty & Crumrine Preferred and Income Fund Incorporated,$18.35,-0.08,-0.434%,207774444.00,United States,1991,22994,,
PFE,Pfizer Inc. Common Stock,$39.95,0.12,0.301%,222847653957.00,United States,,52802169,,
PFGC,Performance Food Group Company Common Stock,$55.96,-1.56,-2.712%,7484592585.00,United States,2015,1080086,,
PFH,Prudential Financial Inc. 4.125% Junior Subordinated Notes due 2060,$25.81,-0.02,-0.077%,0.00,United States,2020,73548,,
PFL,PIMCO Income Strategy Fund Shares of Beneficial Interest,$12.40,0.17,1.39%,410898800.00,United States,2003,187280,,
PFN,PIMCO Income Strategy Fund II,$10.63,0.10,0.95%,791552320.00,United States,2004,287092,,
PFO,Flaherty & Crumrine Preferred and Income Opportunity Fund Incorporated,$13.35,-0.15,-1.111%,170091469.00,United States,1992,25611,,
PFS,Provident Financial Services Inc Common Stock,$24.82,0.53,2.182%,1931816773.00,United States,2003,389121,,
PFSI,PennyMac Financial Services Inc. Common Stock,$59.78,0.25,0.42%,4004692748.00,United States,2013,408067,,
PG,Procter & Gamble Company (The) Common Stock,$134.54,-0.46,-0.341%,329385239028.00,United States,,9624263,,
PGP,Pimco Global Stocksplus & Income Fund Pimco Global StocksPlus & Income Fund Common Shares of Beneficial Interest,$11.08,-0.0499,-0.448%,122345360.00,United States,2005,29305,,
PGR,Progressive Corporation (The) Common Stock,$103.13,0.57,0.556%,60346857973.00,United States,,3055819,,
PGRE,Paramount Group Inc. Common Stock,$10.62,0.03,0.283%,2325255330.00,United States,2014,1398021,,
PGTI,PGT Innovations Inc.,$27.62,-0.10,-0.361%,1670412662.00,United States,2006,382544,,
PGZ,Principal Real Estate Income Fund Common Shares of Beneficial Interest,$14.94,-0.66,-4.231%,102582851.00,,2013,70615,,
PH,Parker-Hannifin Corporation Common Stock,$313.76,2.38,0.764%,40500506330.00,United States,,1441292,,
PHD,Pioneer Floating Rate Fund Inc.,$11.26,0.00,0.00%,278551839.00,United States,2004,62827,,
PHG,Koninklijke Philips N.V. NY Registry Shares,$56.34,-1.02,-1.778%,51003982260.00,Netherlands,,552483,,
PHI,PLDT Inc. Sponsored ADR,$25.74,-0.36,-1.379%,5561275649.00,Philippines,,102330,,
PHK,Pimco High Income Fund Pimco High Income Fund,$6.88,0.06,0.88%,916952640.00,United States,2003,593654,,
PHM,PulteGroup Inc. Common Stock,$60.90,0.57,0.945%,16014636769.00,United States,,2806644,,
PHR,Phreesia Inc. Common Stock,$48.90,-1.72,-3.398%,2448670874.00,United States,2019,608441,,
PHT,Pioneer High Income Fund Inc.,$9.95,0.025,0.252%,290856121.00,United States,,50936,,
PHX,PHX Minerals Inc. Common Stock,$3.03,-0.12,-3.81%,84641241.00,United States,,635273,,
PIAI,Prime Impact Acquisition I Class A Ordinary Shares,$9.82,-0.01,-0.102%,304951390.00,,2020,22535,,
PICC,Pivotal Investment Corporation III Class A Common Stock,$9.80,0.03,0.307%,338100000.00,,2021,1015,,
PII,Polaris Inc. Common Stock,$142.28,-0.44,-0.308%,8713522573.00,United States,,441128,,
PIM,Putnam Master Intermediate Income Trust Common Stock,$4.27,0.00,0.00%,218519671.00,United States,1988,182875,,
PINE,Alpine Income Property Trust Inc. Common Stock,$18.04,-0.04,-0.221%,143102480.00,United States,2019,44719,,
PING,Ping Identity Holding Corp. Common Stock,$22.79,-0.78,-3.309%,1856095086.00,United States,2019,707730,,
PINS,Pinterest Inc. Class A Common Stock,$62.30,-1.41,-2.213%,39581001684.00,,2019,21605996,,
PIPP,Pine Island Acquisition Corp. Class A Common Stock,$9.99,-0.01,-0.10%,272712015.00,United States,2021,192692,,
PIPR,Piper Sandler Companies Common Stock,$116.71,-0.46,-0.393%,2132759474.00,United States,,76415,,
PJT,PJT Partners Inc. Class A Common Stock,$70.64,-2.04,-2.807%,2911807926.00,United States,2015,227737,,
PK,Park Hotels & Resorts Inc. Common Stock ,$22.28,-0.54,-2.366%,5265999381.00,United States,2016,2544450,,
PKE,Park Aerospace Corp. Common Stock,$13.68,-0.27,-1.935%,278817908.00,United States,,50047,,
PKG,Packaging Corporation of America Common Stock,$151.88,2.41,1.612%,14427913958.00,United States,2000,545113,,
PKI,PerkinElmer Inc. Common Stock,$127.81,-2.75,-2.106%,14322617891.00,United States,,1352756,,
PKO,Pimco Income Opportunity Fund Common Shares of Beneficial Interest,$26.895,0.185,0.693%,558597424.00,United States,,66505,,
PKX,POSCO Common Stock,$84.32,1.30,1.566%,25506992924.00,South Korea,1994,129429,,
PLAN,Anaplan Inc. Common Stock,$55.85,-1.70,-2.954%,8074990151.00,United States,2018,3549570,,
PLD,Prologis Inc. Common Stock,$115.60,-0.41,-0.353%,85517758800.00,United States,,2704406,,
PLNT,Planet Fitness Inc. Common Stock,$81.61,-0.89,-1.079%,7064596336.00,United States,2015,1023323,,
PLOW,Douglas Dynamics Inc. Common Stock,$44.76,-0.18,-0.401%,1023099775.00,United States,2010,68869,,
PLT,Plantronics Inc. Common Stock,$38.94,-1.03,-2.577%,1606761127.00,United States,1994,302551,,
PLTR,Palantir Technologies Inc. Class A Common Stock,$21.64,-0.66,-2.96%,40408507185.00,,2020,63429554,,
PLYM,Plymouth Industrial REIT Inc. Common Stock,$18.53,-0.13,-0.697%,520950882.00,United States,2017,305801,,
PM,Philip Morris International Inc Common Stock,$94.91,-0.94,-0.981%,147920746385.00,United States,,5339823,,
PMF,PIMCO Municipal Income Fund Common Stock,$14.69,0.15,1.032%,381073290.00,United States,2001,60818,,
PML,Pimco Municipal Income Fund II Common Shares of Beneficial Interest,$14.91,-0.01,-0.067%,939016890.00,United States,2002,49957,,
PMM,Putnam Managed Municipal Income Trust Common Stock,$8.42,0.05,0.597%,411569608.00,United States,1989,35993,,
PMO,Putnam Municipal Opportunities Trust Common Stock,$13.95,0.05,0.36%,475830120.00,United States,1993,38436,,
PMT,PennyMac Mortgage Investment Trust Common Shares of Beneficial Interest,$19.97,-0.16,-0.795%,1955828850.00,United States,2009,739144,,
PMT^A,PennyMac Mortgage Investment Trust 8.125% Series A Fixed-to-Floating Rate Cumulative Redeemable Preferred Shares of Beneficial Interest,$26.07,-0.11,-0.42%,,United States,,3725,,
PMT^B,PennyMac Mortgage Investment Trust 8.00% Series B Fixed-to-Floating Rate Cumulative Redeemable Preferred Shares of Beneficial Interest,$26.30,-0.09,-0.341%,,United States,,11055,,
PMVC,PMV Consumer Acquisition Corp. Class A Common Stock,$9.84,-0.05,-0.506%,215250000.00,United States,2020,11200,,
PMX,PIMCO Municipal Income Fund III Common Shares of Beneficial Interest,$12.46,0.04,0.322%,413111300.00,United States,2002,36928,,
PNC,PNC Financial Services Group Inc. (The) Common Stock,$193.32,5.20,2.764%,82161000000.00,United States,,2734464,,
PNC^P,PNC Financial Services Group Inc. (The) Depositary Shares Representing 1/4000th Perpetual Preferred Series P,$26.35,0.02,0.076%,,United States,,100101,,
PNF,PIMCO New York Municipal Income Fund Common Stock,$12.24,0.00,0.00%,95826960.00,United States,2001,27009,,
PNI,Pimco New York Municipal Income Fund II Common Shares of Beneficial Interest,$11.70,-0.04,-0.341%,130911300.00,United States,2002,19541,,
PNM,PNM Resources Inc. (Holding Co.) Common Stock,$49.53,-0.01,-0.02%,4251401309.00,United States,,673200,,
PNR,Pentair plc. Ordinary Share,$66.40,1.05,1.607%,11035792349.00,Switzerland,,1117884,,
PNTM,Pontem Corporation Class A Ordinary Shares,$9.72,-0.03,-0.308%,838350000.00,,2021,23204,,
PNW,Pinnacle West Capital Corporation Common Stock,$84.63,0.10,0.118%,9541466495.00,United States,,992702,,
POR,Portland General Electric Co Common Stock,$50.41,-0.07,-0.139%,4515510684.00,United States,,446607,,
POST,Post Holdings Inc. Common Stock,$114.92,0.05,0.044%,7397115169.00,United States,2012,342311,,
PPG,PPG Industries Inc. Common Stock,$178.75,5.74,3.318%,42380048246.00,United States,,1945943,,
PPL,PPL Corporation Common Stock,$29.08,-0.06,-0.206%,22374644092.00,United States,,3926648,,
PPR,Voya Prime Rate Trust Shares of Beneficial Interest,$4.58,-0.005,-0.109%,559983455.00,United States,,291324,,
PPT,Putnam Premier Income Trust Common Stock,$4.74,0.00,0.00%,484485558.00,United States,1988,346659,,
PPX,PPL Capital Funding Inc. 2013 Series B Junior Subordinated Notes due 2073,$25.51,0.05,0.196%,0.00,,,115389,,
PQG,PQ Group Holdings Inc. Common Stock,$14.54,0.45,3.194%,1990881619.00,United States,2017,765007,,
PRA,ProAssurance Corporation Common Stock,$25.85,0.15,0.584%,1396660119.00,United States,,217730,,
PRE^J,PartnerRe Ltd. 4.875% Fixed Rate Non-Cumulative Redeemable Preferred Shares Series J,$26.69,0.06,0.225%,,Bermuda,,60338,,
PRG,PROG Holdings Inc. Common Stock,$53.55,1.47,2.823%,3626795737.00,United States,,570644,Miscellaneous,Diversified Commercial Services
PRGO,Perrigo Company plc Ordinary Shares,$42.13,-0.24,-0.566%,5627184072.00,United States,,884436,,
PRI,Primerica Inc. Common Stock,$161.50,-0.27,-0.167%,6365374728.00,United States,2010,75566,,
PRIF^B,Priority Income Fund Inc. 6.25% Series B Term Preferred Stock due 2023  par value $0.01 per share,$25.22,-0.04,-0.158%,,,,9361,,
PRIF^C,Priority Income Fund Inc. 6.625% Series C Term Preferred Stock due 2024 par value $0.01 per share,$25.29,-0.11,-0.433%,,,,11744,,
PRIF^E,Priority Income Fund Inc. 6.375% Series E Preferred Stock Due 2024,$25.30,-0.01,-0.04%,,,,975,,
PRIF^F,Priority Income Fund Inc. 6.625% Series F Term Preferred Stock due 2027,$25.55,-0.25,-0.969%,,,,2042,,
PRIF^G,Priority Income Fund Inc. 6.25% Series G Preferred Stock Due 2026,$25.30,0.0984,0.39%,,,,12353,,
PRLB,Proto Labs Inc. Common stock,$102.75,-3.92,-3.675%,2845121402.00,United States,2012,386829,,
PRMW,Primo Water Corporation Common Stock,$16.40,-0.57,-3.359%,2637315701.00,Canada,,1291797,,
PRO,PROS Holdings Inc. Common Stock,$40.95,-1.70,-3.986%,1811440736.00,United States,2007,423586,,
PROS,ProSight Global Inc. Common Stock,$12.76,0.02,0.157%,557977191.00,United States,2019,91743,,
PRPB,CC Neuberger Principal Holdings II Class A Ordinary Shares,$10.07,0.07,0.70%,1092595000.00,United States,2020,882045,,
PRPC,CC Neuberger Principal Holdings III Class A Ordinary Shares,$9.88,0.005,0.051%,0.00,,2021,157192,,
PRS,Prudential Financial Inc. 5.625% Junior Subordinated Notes due 2058,$27.70,0.09,0.326%,943505406.00,United States,2018,24942,,
PRSP,Perspecta Inc. Common Stock ,$29.32,0.04,0.137%,4727163062.00,,1998,3984710,,
PRT,PermRock Royalty Trust Trust Units,$5.77,0.11,1.943%,70196274.00,United States,2018,25778,,
PRTY,Party City Holdco Inc. Common Stock,$7.20,-0.12,-1.639%,801134611.00,United States,2015,2749430,,
PRU,Prudential Financial Inc. Common Stock,$101.67,0.23,0.227%,40201950312.00,United States,2001,2056599,,
PSA,Public Storage Common Stock,$279.35,1.32,0.475%,48880143409.00,United States,,691079,,
PSA^C,Public Storage Depositary Shares Each Representing 1/1000 of a 5.125% Cumulative Preferred Share of Beneficial Interest Series C,$25.58,0.07,0.274%,,United States,,10376,,
PSA^D,Public Storage Depositary Shares Each Representing 1/1000 of a 4.95% Cumulative Preferred Share of Beneficial Interest Series D,$25.63,0.1286,0.504%,,United States,,17087,,
PSA^E,Public Storage Depositary Shares Each Representing 1/1000 of a 4.90% Cumulative Preferred Share of Beneficial Interest Series E,$26.02,0.08,0.308%,,United States,,6932,,
PSA^F,Public Storage Depositary Shares Each Representing 1/1000 of a 5.15% Cumulative Preferred Share of Beneficial Interest Series F par value $0.01 per share,$26.88,0.07,0.261%,,United States,,20282,,
PSA^G,Public Storage Depositary Shares Each Representing 1/1000 of a 5.05% Cumulative Preferred Share of Beneficial Interest Series G,$26.72,0.12,0.451%,,United States,,7433,,
PSA^H,Public Storage Depositary Shares Each Representing 1/1000 of a  5.60% Cumulative Preferred  Share of Beneficial Interest Series H,$28.54,0.00,0.00%,,United States,,11516,,
PSA^I,Public Storage Depositary Shares Each Representing 1/1000 of a 4.875% Cumulative Preferred Share of Beneficial Interest Series I par value $0.01 per share,$27.77,0.08,0.289%,,United States,,20264,,
PSA^J,Public Storage Depositary Shares Each Representing 1/1000 of a 4.700% Cumulative Preferred Share of Beneficial Interest Series J par value $0.01 per share,$27.63,0.08,0.29%,,United States,,26702,,
PSA^K,Public Storage Depositary Shares Each Representing 1/1000 of a 4.75% Cumulative Preferred Share of Beneficial Interest Series K,$27.98,0.16,0.575%,,United States,,7227,,
PSA^L,Public Storage Depositary Shares Each Representing 1/1000 of a 4.625% Cumulative Preferred Share of Beneficial Interest Series L par value $0.01 per share,$26.99,0.14,0.521%,,United States,,38420,,
PSA^M,Public Storage Depositary Shares Each Representing 1/1000 of a 4.125% Cumulative Preferred Share of Beneficial Interest Series M,$26.21,-0.08,-0.304%,,United States,,7547,,
PSA^N,Public Storage Depositary Shares Each Representing 1/1000 of a 3.875% Cumulative Preferred Share of Beneficial Interest Series N,$25.50,0.02,0.078%,,United States,,25548,,
PSA^O,Public Storage Depositary Shares Each Representing 1/1000 of a 3.900% Cumulative Preferred Share of Beneficial Interest Series O,$26.13,0.03,0.115%,,United States,,54133,,
PSB,PS Business Parks Inc. Common Stock,$160.28,-2.74,-1.681%,4412349242.00,United States,,69957,,
PSB^W,PS Business Parks Inc. Depositary Shares Each Representing 1/1000 of a Share of 5.20% Cumulative Preferred Stock Series W,$26.00,0.08,0.309%,,United States,,7514,,
PSB^X,PS Business Parks Inc. Depositary Shares Each Representing 1/1000 of a Share of 5.25% Cumulative Preferred Stock Series X,$26.73,-0.04,-0.149%,,United States,,31662,,
PSB^Y,PS Business Parks Inc. 5.20% Cumulative Preferred Stock Series Y,$26.80,0.125,0.469%,,United States,,11276,,
PSB^Z,PS Business Parks Inc. Depositary Shares Each Representing 1/1000 of a Share of 4.875% Cumulative Preferred Stock Series Z  par value $0.01 per share,$27.19,0.05,0.184%,,United States,,12698,,
PSF,Cohen & Steers Select Preferred and Income Fund Inc. Common Stock,$30.605,0.185,0.608%,367767676.00,,2010,16623,,
PSFE,Paysafe Limited Common Shares,$13.59,-0.31,-2.23%,9835251271.00,,2021,4875636,,
PSN,Parsons Corporation Common Stock,$43.70,0.02,0.046%,4473160929.00,,2019,356897,,
PSO,Pearson Plc Common Stock,$11.08,-0.53,-4.565%,8351366981.00,United Kingdom,,249016,,
PSTG,Pure Storage Inc. Class A Common Stock,$18.90,-0.69,-3.522%,5298346507.00,,2015,4349602,,
PSTH,Pershing Square Tontine Holdings Ltd. Class A Common Stock,$24.31,-0.20,-0.816%,4862002431.00,,2020,1405226,,
PSTL,Postal Realty Trust Inc. Class A Common Stock,$19.40,-0.22,-1.121%,258534372.00,,2019,186674,,
PSX,Phillips 66 Common Stock,$83.03,-0.91,-1.084%,36356101494.00,United States,,2867576,,
PSXP,Phillips 66 Partners LP Common Units representing limited partner interest in the Partnership,$34.21,0.03,0.088%,7811516395.00,United States,2013,868255,,
PTA,Cohen & Steers Tax-Advantaged Preferred Securities and Income Fund Common Shares of Beneficial Interest,$25.52,0.03,0.118%,1410578623.00,,2020,63003,,
PTR,PetroChina Company Limited Common Stock,$37.28,0.78,2.137%,68230220524.00,China,,226113,,
PTY,Pimco Corporate & Income Opportunity Fund,$19.20,0.17,0.893%,2123840851.00,United States,2002,525045,,
PUK,Prudential Public Limited Company Common Stock,$42.39,-0.80,-1.852%,55437715843.00,United Kingdom,,359205,,
PUK^,Prudential Public Limited Company 6.75% Perpetual Subordinated Captial Security,$27.855,0.045,0.162%,,United Kingdom,,9423,,
PUK^A,Prudential Public Limited Company 6.50% Perpetual Subordinated Capital Securities Exchangeable at the Issuer's Option Into Non-Cumulative Dollar Denominated Preference Shares,$28.04,0.191,0.686%,,United Kingdom,,17141,,
PUMP,ProPetro Holding Corp. Common Stock,$10.36,-0.36,-3.358%,1057318963.00,United States,2017,745993,,
PV,Primavera Capital Acquisition Corporation Class A Ordinary Shares,$10.00,-0.10,-0.99%,537500000.00,,2021,11663,,
PVG,Pretium Resources Inc. Ordinary Shares (Canada),$11.10,-0.14,-1.246%,2084392232.00,Canada,,1458006,,
PVH,PVH Corp. Common Stock,$116.24,-0.40,-0.343%,8272845087.00,United States,,509630,,
PVL,Permianville Royalty Trust Trust Units ,$1.55,0.01,0.649%,51150000.00,United States,2011,167653,,
PWR,Quanta Services Inc. Common Stock,$97.65,0.47,0.484%,13621507074.00,United States,,729144,,
PXD,Pioneer Natural Resources Company Common Stock,$158.45,-0.21,-0.132%,34345224291.00,United States,,1788275,,
PYN,PIMCO New York Municipal Income Fund III Common Shares of Beneficial Interest,$10.6148,0.1248,1.19%,60801574.00,United States,2002,11268,,
PYS,Merrill Lynch Depositor Inc PPlus Tr Ser RRD-1 Tr Ctf Cl A,$21.68,0.00,0.00%,0.00,United States,,4,,
PZC,PIMCO California Municipal Income Fund III Common Shares of Beneficial Interest,$10.99,0.13,1.197%,245967190.00,United States,2002,38834,,
PZN,Pzena Investment Management Inc Class A Common Stock,$11.01,-0.02,-0.181%,799215471.00,United States,2007,45186,,
QD,Qudian Inc. American Depositary Shares each representing one Class A Ordinary Share,$2.06,0.04,1.98%,521361688.00,China,2017,3034345,,
QFTA,Quantum FinTech Acquisition Corporation Common Stock,$9.72,-0.02,-0.205%,244518750.00,,2021,6359,,
QGEN,Qiagen N.V. Common Shares ,$47.94,0.32,0.672%,10924149930.00,Netherlands,,1460756,,
QS,QuantumScape Corporation Class A Common Stock,$34.71,-0.55,-1.56%,13558677956.00,United States,2020,6442333,,
QSR,Restaurant Brands International Inc. Common Shares,$69.86,-0.55,-0.781%,21175492274.00,Canada,2014,661411,,
QTS,QTS Realty Trust Inc. Class A Common Stock,$64.27,-0.46,-0.711%,4176682548.00,United States,2013,333181,,
QTS^A,QTS Realty Trust Inc. 7.125% Series A Cumulative Redeemable Perpetual Preferred Stock,$27.90,0.01,0.036%,,United States,,836,,
QTS^B,QTS Realty Trust Inc. 6.50% Series B Cumulative Convertible Perpetual Preferred Stock,$144.20,-1.04,-0.716%,,United States,,1313,,
QTWO,Q2 Holdings Inc. Common Stock,$98.40,-4.60,-4.466%,5470991981.00,,2014,536619,,
QUAD,Quad Graphics Inc Class A Common Stock,$3.60,-0.11,-2.965%,194424116.00,United States,,288505,,
QUOT,Quotient Technology Inc. Common Stock,$17.01,0.21,1.25%,1588043904.00,,2014,783940,,
QVCC,QVC Inc. 6.250% Senior Secured Notes due 2068,$25.78,0.03,0.117%,0.00,United States,2019,26993,,
QVCD,QVC Inc. 6.375% Senior Secured Notes due 2067,$25.73,0.04,0.156%,0.00,United States,2018,9284,,
R,Ryder System Inc. Common Stock,$81.92,1.65,2.056%,4413062103.00,United States,,551438,,
RA,Brookfield Real Assets Income Fund Inc. Common Stock,$21.75,-0.23,-1.046%,954670640.00,,2016,528988,,
RAAS,Cloopen Group Holding Limited American Depositary Shares each representing two Class A Ordinary Shares,$9.89,-0.31,-3.039%,1580870027.00,,2021,1092560,,
RACE,Ferrari N.V. Common Shares,$202.98,-15.00,-6.881%,50375284718.00,,2015,1148325,,
RAD,Rite Aid Corporation Common Stock,$17.53,-0.41,-2.285%,965932117.00,United States,,2243597,,
RAMP,LiveRamp Holdings Inc. Common Stock,$48.25,-0.64,-1.309%,3228861581.00,United States,2018,634909,,
RBA,Ritchie Bros. Auctioneers Incorporated Common Stock,$62.41,-0.73,-1.156%,6863107748.00,Canada,,623580,,
RBAC,RedBall Acquisition Corp. Class A Ordinary Shares,$9.97,-0.03,-0.30%,716593750.00,United States,2020,181353,,
RBC,Regal Beloit Corporation Common Stock,$144.77,0.03,0.021%,5881060765.00,United States,,414320,,
RBLX,Roblox Corporation Class A Common Stock,$69.62,-1.46,-2.054%,38328625990.00,,2021,5379943,,
RC,Ready Capital Corproation Common Stock,$14.31,-0.20,-1.378%,1018830358.00,United States,2013,546656,,
RC^B,Ready Capital Corporation 8.625% Series B Cumulative Preferred Stock,$25.37,-0.03,-0.118%,,United States,,3744,,
RC^C,Ready Capital Corporation 6.25% Series C Cumulative Convertible Preferred Stock,$25.12,0.00,0.00%,,United States,,80,,
RC^D,Ready Capital Corporation 7.625% Series D Cumulative Redeemable Preferred Stock,$25.2101,0.0101,0.04%,,United States,,5662,,
RCA,Ready Capital Corporation 7.00% Convertible Senior Notes due 2023,$26.12,0.04,0.153%,0.00,United States,2017,1159,,
RCB,Ready Capital Corporation 6.20% Senior Notes due 2026,$25.97,-0.8201,-3.061%,0.00,United States,2019,4362,,
RCC,Ready Capital Corporation 5.75% Senior Notes due 2026,$25.50,-0.05,-0.196%,,United States,2021,31983,,
RCI,Rogers Communication Inc. Common Stock,$49.14,-0.35,-0.707%,24812030127.00,Canada,,310853,,
RCL,D/B/A Royal Caribbean Cruises Ltd. Common Stock,$83.99,-3.92,-4.459%,21381389481.00,United States,1993,4689895,,
RCS,PIMCO Strategic Income Fund Inc.,$7.61,-0.04,-0.523%,336255460.00,United States,1994,162336,,
RCUS,Arcus Biosciences Inc. Common Stock,$32.70,-1.40,-4.106%,2321409362.00,,2018,659656,,
RDN,Radian Group Inc. Common Stock,$24.70,-0.02,-0.081%,4725100639.00,United States,,1548873,,
RDS/B,Royal Dutch Shell PLC,$36.21,-0.61,-1.657%,,Netherlands,,7431986,,
RDY,Dr. Reddy's Laboratories Ltd Common Stock,$69.05,-1.43,-2.029%,11483100001.00,India,,110904,,
RE,Everest Re Group Ltd. Common Stock,$273.42,1.35,0.496%,10959220440.00,Bermuda,,441050,,
RELX,RELX PLC PLC American Depositary Shares (Each representing One Ordinary Share),$25.92,-0.45,-1.706%,50094121490.00,United Kingdom,2015,882135,,
RENN,Renren Inc. American Depositary Shares each representing fifteen Class A ordinary shares,$9.79,-0.52,-5.044%,230846653.00,China,2011,38348,,
RES,RPC Inc. Common Stock,$5.34,0.14,2.692%,1152430548.00,United States,,971767,,
REV,Revlon Inc. New Common Stock,$10.88,-0.30,-2.683%,581931727.00,United States,1996,218097,,
REVG,REV Group Inc. Common Stock,$18.44,-0.20,-1.073%,1193771781.00,United States,2017,233371,,
REX,REX American Resources Corporation,$85.12,0.85,1.009%,510039210.00,United States,,16047,,
REXR,Rexford Industrial Realty Inc. Common Stock,$54.96,-0.21,-0.381%,7358998906.00,United States,2013,447841,,
REXR^A,Rexford Industrial Realty Inc. 5.875% Series A Cumulative Redeemable Preferred Stock,$25.36,-0.12,-0.471%,,United States,,353,,
REXR^B,Rexford Industrial Realty Inc. 5.875% Series B Cumulative Redeemable Preferred Stock,$26.26,-0.03,-0.114%,,United States,,1880,,
REXR^C,Rexford Industrial Realty Inc. 5.625% Series C Cumulative Redeemable Preferred Stock par value $0.01 per share,$27.43,-0.17,-0.616%,,United States,,1732,,
REZI,Resideo Technologies Inc. Common Stock ,$28.92,-1.64,-5.366%,4190408284.00,,2018,592329,,
RF,Regions Financial Corporation Common Stock,$22.32,0.52,2.385%,21442244394.00,United States,,8167385,,
RF^A,Regions Financial Corporation Depositary Shares Representing 1/40th Perpetual Preferred Series A,$25.42,-0.03,-0.118%,,United States,,31675,,
RF^B,Regions Financial Corporation Depositary Shares Representing 1/40th Perpetual Preferred Series B,$29.00,0.16,0.555%,,United States,,30930,,
RF^C,Regions Financial Corporation Depositary Shares each Representing a 1/40th Interest in a  Share of 5.700% Fixed-to-Floating Rate Non-Cumulative  Perpetual Preferred Stock Series C,$27.76,0.03,0.108%,,United States,,62139,,
RFI,Cohen & Steers Total Return Realty Fund Inc. Common Stock,$16.03,-0.09,-0.558%,420797102.00,United States,1993,57531,,
RFL,Rafael Holdings Inc. Class B Common Stock,$43.28,0.58,1.358%,721548406.00,United States,2018,39355,,
RFM,RiverNorth Flexible Municipal Income Fund Inc. Common Stock,$23.36,0.31,1.345%,142839369.00,,2020,13253,,
RFMZ,RiverNorth Flexible Municipal Income Fund II Inc. Common Stock,$19.99,-0.04,-0.20%,0.00,,2021,77388,,
RFP,Resolute Forest Products Inc. Common Stock,$15.16,0.60,4.121%,1210234140.00,Canada,,1140633,,
RGA,Reinsurance Group of America Incorporated Common Stock,$129.45,-1.61,-1.228%,8800689706.00,United States,,437847,,
RGR,Sturm Ruger & Company Inc. Common Stock,$68.03,1.36,2.04%,1196116454.00,United States,,191663,,
RGS,Regis Corporation Common Stock,$12.47,-0.05,-0.399%,483333035.00,United States,1991,221198,,
RGT,Royce Global Value Trust Inc. Common Stock,$14.685,-0.115,-0.777%,82247616.00,,2013,8529,,
RH,RH Common Stock,$687.20,-11.85,-1.695%,14429012642.00,United States,2012,520112,,
RHI,Robert Half International Inc. Common Stock,$89.16,1.61,1.839%,10055517583.00,United States,,679026,,
RHP,Ryman Hospitality Properties Inc. (REIT),$76.05,-5.32,-6.538%,4186541549.00,United States,,909832,,
RICE,Rice Acquisition Corp. Class A Common Stock,$14.75,-0.58,-3.783%,437468038.00,United States,2020,198610,,
