Symbol,Name,Last Sale,Net Change,% Change,Market Cap,Country,IPO Year,Volume,Sector,Industry
DFNS,LGL Systems Acquisition Corp. Common Stock,$9.95,0.00,0.00%,214546875.00,United States,2020,90990,,
DFP,Flaherty & Crumrine Dynamic Preferred and Income Fund Inc. Common Stock,$30.222,-0.128,-0.422%,579991218.00,,2013,34488,,
DFS,Discover Financial Services Common Stock,$115.42,0.78,0.68%,35358336437.00,United States,,2525035,,
DG,Dollar General Corporation Common Stock,$216.24,-0.33,-0.152%,51738501852.00,United States,2009,1916710,,
DGNR,Dragoneer Growth Opportunities Corp. Class A Ordinary Shares,$10.29,0.05,0.488%,887512500.00,United States,2020,336849,,
DGX,Quest Diagnostics Incorporated Common Stock,$136.39,3.68,2.773%,16580353597.00,United States,,1498736,,
DHF,BNY Mellon High Yield Strategies Fund Common Stock,$3.20,0.01,0.313%,232664602.00,United States,1998,1202050,,
DHI,D.R. Horton Inc. Common Stock,$101.66,0.81,0.803%,36646755355.00,United States,,2250833,,
DHR,Danaher Corporation Common Stock,$256.03,1.36,0.534%,182620788062.00,United States,,2000482,,
DHR^A,Danaher Corporation 4.75% Mandatory Convertible Preferred Stock Series A,$1708.392,-12.688,-0.737%,,United States,,19359,,
DHR^B,Danaher Corporation 5.00% Mandatory Convertible Preferred Stock Series B,$1432.41,2.605,0.182%,,United States,,480,,
DHT,DHT Holdings Inc.,$6.03,-0.10,-1.631%,1034138994.00,Jersey,2005,2295135,,
DHX,DHI Group Inc. Common Stock,$3.04,-0.06,-1.935%,159105520.00,United States,2007,126572,,
DIAX,Nuveen Dow 30SM Dynamic Overwrite Fund Common Shares of Beneficial Interest,$16.67,0.02,0.12%,606236456.00,,2014,52288,,
DIN,Dine Brands Global Inc. Common Stock,$96.97,0.49,0.508%,1654093508.00,United States,,303186,,
DIS,Walt Disney Company (The) Common Stock,$184.25,-1.26,-0.679%,334462373391.00,United States,,7069321,,
DK,Delek US Holdings Inc. Common Stock,$24.80,-0.60,-2.362%,1832104886.00,United States,2017,583741,,
DKL,Delek Logistics Partners L.P. Common Units representing Limited Partner Interests,$42.25,-0.22,-0.518%,1835480946.00,United States,2012,80691,,
DKS,Dick's Sporting Goods Inc Common Stock,$87.43,1.45,1.686%,7805865458.00,United States,2002,1680418,,
DLB,Dolby Laboratories Common Stock,$103.53,0.12,0.116%,10519990059.00,United States,2005,980385,,
DLNG,Dynagas LNG Partners LP Common Units,$2.80,-0.05,-1.754%,99715224.00,Greece,,73578,,
DLNG^A,Dynagas LNG Partners LP 9.00% Series A Cumulative Redeemable Preferred Units,$25.4599,-0.5001,-1.926%,,Greece,,6158,,
DLNG^B,Dynagas LNG Partners LP 8.75% Series B Fixed to Floating Rate Cumulative Redeemable Perpetual Preferred Units liquidation preference $25.00 per Uni,$23.8218,-0.0682,-0.285%,,Greece,,8947,,
DLR,Digital Realty Trust Inc. Common Stock,$153.01,1.34,0.883%,43054115991.00,United States,2004,1553129,,
DLR^C,Digital Realty Trust Inc. 6.625% Series C Cumulative Redeemable Perpetual Preferred Stock,$25.20,0.0067,0.027%,,United States,,8595,,
DLR^J,Digital Realty Trust Inc. 5.250% Series J Cumulative Redeemable Preferred Stock,$26.80,0.04,0.149%,,United States,,10134,,
DLR^K,Digital Realty Trust Inc. 5.850% Series K Cumulative Redeemable Preferred Stock par value $0.01 per share,$28.1536,-0.0204,-0.072%,,United States,,7504,,
DLR^L,Digital Realty Trust Inc. 5.200% Series L Cumulative Redeemable Preferred Stock,$27.52,0.064,0.233%,,United States,,14192,,
DLX,Deluxe Corporation Common Stock,$46.16,1.24,2.76%,1943348694.00,United States,,273053,,
DLY,DoubleLine Yield Opportunities Fund Common Shares of Beneficial Interest,$19.95,0.13,0.656%,0.00,,2020,364438,,
DM,Desktop Metal Inc. Class A Common Stock,$12.20,-0.88,-6.728%,2982274726.00,,2019,2945064,,
DMB,BNY Mellon Municipal Bond Infrastructure Fund Inc. Common Stock,$14.72,0.09,0.615%,270665075.00,,2013,10482,,
DMO,Western Asset Mortgage Opportunity Fund Inc. Common Stock,$14.78,-0.28,-1.859%,162980745.00,United States,2010,178061,,
DMS,Digital Media Solutions Inc. Class A Ordinary Shares,$12.06,0.19,1.601%,739050826.00,United States,2018,51755,,
DMYI,dMY Technology Group Inc. III Class A Common Stock,$10.63,-0.18,-1.665%,398625000.00,United States,2021,145310,,
DMYQ,dMY Technology Group Inc. IV Class A Common Stock,$9.90,0.00,0.00%,426937500.00,,2021,6826,,
DNB,Dun & Bradstreet Holdings Inc. Common Stock,$23.87,-0.27,-1.118%,10250713561.00,United States,2020,1978459,,
DNMR,Danimer Scientific Inc. Common Stock,$22.14,-1.49,-6.306%,1955575699.00,,2020,6244277,,
DNOW,NOW Inc. Common Stock,$10.18,-0.05,-0.489%,1129887586.00,,2014,488793,,
DNP,DNP Select Income Fund Inc. Common Stock,$10.20,-0.11,-1.067%,3154886000.00,United States,1987,945266,,
DNZ,D and Z Media Acquisition Corp. Class A Common Stock,$9.76,-0.01,-0.102%,350750000.00,,2021,2618,,
DOC,Physicians Realty Trust Common Shares of Beneficial Interest,$18.53,-0.13,-0.697%,3906592216.00,United States,2013,1996822,,
DOCN,DigitalOcean Holdings Inc. Common Stock,$43.52,0.06,0.138%,4636316116.00,,2021,311463,,
DOOR,Masonite International Corporation Ordinary Shares (Canada),$126.25,-2.59,-2.01%,3098214895.00,Canada,,204359,,
DOV,Dover Corporation Common Stock,$151.54,1.77,1.182%,21810738799.00,United States,,616892,,
DOW,Dow Inc. Common Stock ,$66.22,1.67,2.587%,49465640849.00,,2019,7367207,,
DPG,Duff & Phelps Utility and Infrastructure Fund Inc.,$14.505,-0.175,-1.192%,550171836.00,United States,2011,254739,,
DPZ,Domino's Pizza Inc Common Stock,$433.99,0.40,0.092%,16851134278.00,United States,2004,744550,,
DQ,DAQO New Energy Corp. American Depositary Shares each representing five ordinary shares,$74.51,-5.03,-6.324%,5477496846.00,China,2010,1561907,,
DRD,DRDGOLD Limited American Depositary Shares,$10.13,-0.18,-1.746%,866230269.00,South Africa,,132231,,
DRE,Duke Realty Corporation Common Stock,$46.21,-0.15,-0.324%,17328069327.00,United States,,2693087,,
DRH,Diamondrock Hospitality Company Common Stock,$10.09,-0.55,-5.169%,2135847608.00,United States,2005,2060037,,
DRH^A,Diamondrock Hospitality Company 8.250% Series A Cumulative Redeemable Preferred Stock,$28.31,-0.4445,-1.546%,,United States,,1032,,
DRI,Darden Restaurants Inc. Common Stock,$143.75,-0.86,-0.595%,18808634388.00,United States,,1432680,,
DRQ,Dril-Quip Inc. Common Stock,$32.18,0.16,0.50%,1140098076.00,United States,1997,223021,,
DRUA,Dominion Energy Inc. 2016 Series A 5.25% Enhanced Junior Subordinated Notes due 2076,$25.37,0.05,0.197%,0.00,United States,2016,83176,,
DS,Drive Shack Inc.,$3.38,-0.08,-2.312%,308564442.00,United States,,1935169,,
DS^B,Drive Shack Inc. Preferred Series B,$25.12,0.01,0.04%,,United States,,4663,,
DS^C,Drive Shack Inc. Preferred Series C,$23.39,0.21,0.906%,,United States,,755,,
DS^D,Drive Shack Inc. Pfd Ser D,$23.29,0.03,0.129%,,United States,,564,,
DSE,Duff & Phelps Select MLP and Midstream Energy Fund Inc.,$8.02,0.06,0.754%,21039307.00,United States,2014,9852,,
DSL,DoubleLine Income Solutions Fund Common Shares of Beneficial Interests,$18.04,-0.02,-0.111%,1839302620.00,,2013,248263,,
DSM,BNY Mellon Strategic Municipal Bond Fund Inc. Common Stock,$8.06,0.04,0.499%,398337379.00,United States,1989,81869,,
DSSI,Diamond S Shipping Inc. Common Stock ,$10.31,-0.13,-1.245%,417073317.00,,2019,195666,,
DSU,Blackrock Debt Strategies Fund Inc. Common Stock,$11.07,-0.01,-0.09%,515771303.00,United States,1998,117813,,
DSX,Diana Shipping inc. common stock,$3.93,-0.02,-0.506%,359732558.00,Greece,2005,1509785,,
DSX^B,Diana Shipping Inc. Perpetual Preferred Shares Series B (Marshall Islands),$25.6807,-0.0393,-0.153%,,Greece,,1096,,
DT,Dynatrace Inc. Common Stock,$48.77,-2.05,-4.034%,13782099772.00,United States,2019,1760654,,
DTB,DTE Energy Company 2020 Series G 4.375% Junior Subordinated Debentures due 2080,$25.15,-0.14,-0.554%,0.00,United States,2020,56044,,
DTE,DTE Energy Company Common Stock,$140.63,0.19,0.135%,27243878777.00,United States,,836614,,
DTF,DTF Tax-Free Income Inc. Common Stock,$14.70,-0.05,-0.339%,103334620.00,United States,1991,2519,,
DTJ,DTE Energy Company 2016 Series B 5.375% Junior Subordinated Debentures due 2076,$25.40,0.03,0.118%,0.00,United States,2016,59328,,
DTLA^,Brookfield DTLA Inc. 7.625% Series A Cumulative Redeemable Preferred Stock,$14.94,-0.07,-0.466%,,,,3040,,
DTP,DTE Energy Company 6.25% Corporate Units,$51.16,0.04,0.078%,0.00,United States,,18088,,
DTW,DTE Energy Company 2017 Series E 5.25% Junior Subordinated Debentures due 2077,$26.31,0.04,0.152%,0.00,United States,2017,31576,,
DTY,DTE Energy Company 2016 Series F 6.00% Junior Subordinated Debentures due 2076,$26.1496,-0.1504,-0.572%,0.00,United States,2016,35816,,
DUK,Duke Energy Corporation (Holding Company) Common Stock,$100.78,0.07,0.07%,77521640684.00,United States,,3096407,,
DUK^A,Duke Energy Corporation Depositary Shares each representing a 1/1000th interest in a share of 5.75% Series A Cumulative Redeemable Perpetual Preferred Stock,$28.33,0.14,0.497%,,United States,,58381,,
DUKB,Duke Energy Corporation 5.625% Junior Subordinated Debentures due 2078,$27.10,0.08,0.296%,0.00,United States,2018,56205,,
DUKH,Duke Energy Corporation 5.125% Junior Subordinated Debentures due 2073,$26.08,-0.11,-0.42%,0.00,United States,,31790,,
DV,DoubleVerify Holdings Inc. Common Stock,$34.63,-1.13,-3.16%,5425812817.00,,2021,239249,,
DVA,DaVita Inc. Common Stock,$123.36,2.44,2.018%,13100832000.00,United States,,714991,,
DVD,Dover Motorsports Inc. Common Stock,$2.30,0.10,4.545%,83824859.00,United States,1996,23623,,
DVN,Devon Energy Corporation Common Stock,$23.45,-0.17,-0.72%,15872951093.00,United States,,10921306,,
DWIN,Delwinds Insurance Acquisition Corp. Class A Common Stock,$9.79,-0.01,-0.102%,252471863.00,,2021,16847,,
DX,Dynex Capital Inc. Common Stock,$20.03,-0.17,-0.842%,618517767.00,United States,,402998,,
DX^C,Dynex Capital Inc. 6.900% Series C Fixed-to-Floating Rate Cumulative Redeemable Preferred Stock,$25.53,-0.1833,-0.713%,,United States,,17108,,
DXC,DXC Technology Company Common Stock ,$32.70,-0.97,-2.881%,8325223571.00,,,2674105,,
DY,Dycom Industries Inc. Common Stock,$95.63,-0.85,-0.881%,2928320944.00,United States,,274376,,
DYFN,Angel Oak Dynamic Financial Strategies Income Term Trust Common Shares of Beneficial Interest,$19.73,-0.07,-0.354%,80005150.00,,2020,13713,,
E,ENI S.p.A. Common Stock,$24.34,-0.16,-0.653%,43477929241.00,Italy,,297232,,
EAF,GrafTech International Ltd. Common Stock,$13.32,-0.01,-0.075%,3559572717.00,United States,2018,4101751,,
EAI,Entergy Arkansas LLC First Mortgage Bonds 4.875% Series Due September 1 2066,$25.70,-0.01,-0.039%,0.00,United States,2016,10662,,
EARN,Ellington Residential Mortgage REIT Common Shares of Beneficial Interest,$12.08,-0.57,-4.506%,149109987.00,United States,2013,170345,,
EAT,Brinker International Inc. Common Stock,$65.66,0.48,0.736%,3004005276.00,United States,,1163514,,
EB,Eventbrite Inc. Class A Common Stock,$22.46,-0.92,-3.935%,2087941860.00,United States,2018,1732696,,
EBF,Ennis Inc. Common Stock,$21.20,0.08,0.379%,552674312.00,United States,,111178,,
EBR,Centrais Electricas Brasileiras S A American Depositary Shares (Each representing one Common Share),$6.76,-0.27,-3.841%,10605972952.00,,2016,629358,,
EBS,Emergent Biosolutions Inc. Common Stock,$59.10,-2.49,-4.043%,3166901750.00,United States,2006,929685,,
EC,Ecopetrol S.A. American Depositary Shares,$11.62,-0.11,-0.938%,23888799609.00,Colombia,,908571,,
ECC           ,Eagle Point Credit Company Inc. Common Stock,$12.84,0.01,0.078%,415436788.00,United States,2014,143649,,
ECCB,Eagle Point Credit Company Inc. 7.75% Series B Term Preferred Stock due 2026,$25.80,0.02,0.078%,0.00,United States,2016,1589,,
ECCW,Eagle Point Credit Company Inc. 6.75% Notes due 2031,$25.39,-0.01,-0.039%,0.00,United States,2021,20266,,
ECCX,Eagle Point Credit Company Inc. 6.6875% Notes due 2028,$25.54,-0.0228,-0.089%,0.00,United States,2018,2762,,
ECCY,Eagle Point Credit Company Inc. 6.75% Notes due 2027,$25.57,-0.16,-0.622%,0.00,United States,2017,152,,
ECL,Ecolab Inc. Common Stock,$228.99,2.04,0.899%,65509027325.00,United States,,989862,,
ECOM          ,ChannelAdvisor Corporation Common Stock,$20.41,-0.50,-2.391%,606495437.00,United States,2013,283022,,
ED,Consolidated Edison Inc. Common Stock,$78.12,0.37,0.476%,26770812652.00,United States,,1526079,,
EDD,Morgan Stanley Emerging Markets Domestic Debt Fund Inc. Morgan Stanley Emerging Markets Domestic Debt Fund Inc. Common Stock,$6.04,-0.04,-0.658%,399196435.00,United States,2007,341984,,
EDF,Stone Harbor Emerging Markets Income Fund Common Shares of Beneficial Interest,$8.36,0.03,0.36%,139410273.00,United States,2010,132935,,
EDI,Stone Harbor Emerging Markets Total Income Fund Common Shares of Beneficial Interests,$8.75,0.05,0.575%,86433883.00,United States,2012,65779,,
EDN,Empresa Distribuidora Y Comercializadora Norte S.A. (Edenor) Empresa Distribuidora Y Comercializadora Norte S.A. (Edenor) American Depositary Shares,$3.57,0.03,0.847%,161802235.00,Argentina,2007,16445,,
EDR,Endeavor Group Holdings Inc. Class A Common Stock,$29.99,-0.82,-2.661%,20448562410.00,,2021,3344592,,
EDU,New Oriental Education & Technology Group Inc. Sponsored ADR representing 1 Ordinary Share (Cayman Islands),$15.08,-0.02,-0.132%,25661015760.00,China,2006,9406300,,
EEA,The European Equity Fund Inc. Common Stock,$11.25,0.01,0.089%,81120285.00,United States,,17640,,
EEX,Emerald Holding Inc. Common Stock,$5.05,-0.33,-6.134%,364981549.00,United States,2017,178400,,
EFC,Ellington Financial Inc. Common Stock ,$17.80,-0.10,-0.559%,779313975.00,United States,2010,444238,,
EFC^A,Ellington Financial Inc. 6.750% Series A Fixed-to-Floating Rate Cumulative Redeemable Preferred Stock,$25.35,-0.08,-0.315%,,United States,,10028,,
EFF,Eaton vance Floating-Rate Income Plus Fund Common Shares of Beneficial Interest,$16.39,0.00,0.00%,124669257.00,,2013,20956,,
EFL,Eaton Vance Floating-Rate 2022 Target Term Trust Common Shares of Beneficial Interest,$9.88,0.18,1.856%,233381527.00,United States,2017,257950,,
EFR,Eaton Vance Senior Floating-Rate Fund Common Shares of Beneficial Interest,$14.10,0.04,0.284%,519561213.00,United States,2003,125379,,
EFT,Eaton Vance Floating Rate Income Trust Common Shares of Beneficial Interest,$14.21,-0.05,-0.351%,566463035.00,United States,2004,65541,,
EFX,Equifax Inc. Common Stock,$237.01,3.12,1.334%,28844715687.00,United States,,696303,,
EGF,Blackrock Enhanced Government Fund Inc. Common Stock,$13.00,0.18,1.404%,55403088.00,United States,2005,23923,,
EGHT,8x8 Inc Common Stock,$30.83,-1.23,-3.837%,3313804910.00,United States,,2771240,,
EGO,Eldorado Gold Corporation Ordinary Shares,$10.40,-0.21,-1.979%,1881458935.00,Canada,,2045302,,
EGP,EastGroup Properties Inc. Common Stock,$154.81,-1.37,-0.877%,6195734143.00,United States,,168752,,
EGY,VAALCO Energy Inc.  Common Stock,$2.51,-0.01,-0.397%,145108835.00,United States,,119293,,
EHC,Encompass Health Corporation Common Stock,$85.46,1.02,1.208%,8483247235.00,United States,,521385,,
EHI,Western Asset Global High Income Fund Inc Common Stock,$10.3301,-0.0299,-0.289%,234465348.00,United States,2003,17640,,
EHT,Eaton Vance 2021 Target Term Trust Common Shares of Beneficial Interest,$9.85,-0.0057,-0.058%,211425364.00,United States,2016,22838,,
EIC,Eagle Point Income Company Inc. Common Stock,$15.50,-0.065,-0.418%,0.00,,2019,7032,,
EIG,Employers Holdings Inc Common Stock,$41.31,-0.19,-0.458%,1178251669.00,United States,2007,170404,,
EIX,Edison International Common Stock,$59.61,0.23,0.387%,22618302339.00,United States,,1710633,,
EL,Estee Lauder Companies Inc. (The) Common Stock,$302.11,13.18,4.562%,109593271337.00,United States,1995,3272875,,
ELAN,Elanco Animal Health Incorporated Common Stock,$31.31,-0.49,-1.541%,14803359922.00,United States,2018,2255131,,
ELAT,Elanco Animal Health Incorporated 5.00% Tangible Equity Units,$47.36,-0.60,-1.251%,0.00,United States,2020,4671,,
ELC,Entergy Louisiana Inc. Collateral Trust Mortgage Bonds 4.875 % Series due September 1 2066,$25.63,-0.02,-0.078%,0.00,United States,2016,8154,,
ELF,e.l.f. Beauty Inc. Common Stock,$29.73,0.19,0.643%,1523394841.00,United States,2016,358714,,
ELP,Companhia Paranaense de Energia (COPEL) American Depositary Shares (each representing one Unit consisting one Common Share and four non-voting Class B Preferred Shares),$5.29,-0.03,-0.564%,28952738675.00,Brazil,2021,2739112,,
ELS,Equity Lifestyle Properties Inc. Common Stock,$68.76,-0.27,-0.391%,12535982082.00,United States,,806496,,
ELVT,Elevate Credit Inc. Common Stock,$3.47,0.23,7.099%,123722808.00,United States,2017,631969,,
ELY,Callaway Golf Company Common Stock,$28.87,-0.18,-0.62%,5331478417.00,United States,1992,1434922,,
EMD,Western Asset Emerging Markets Debt Fund Inc Common Stock,$13.63,-0.11,-0.801%,827968144.00,United States,,161811,,
EME,EMCOR Group Inc. Common Stock,$120.71,0.19,0.158%,6607012600.00,United States,,578596,,
EMF,Templeton Emerging Markets Fund Common Stock,$19.48,-0.12,-0.612%,314916466.00,United States,1987,36557,,
EMN,Eastman Chemical Company Common Stock,$121.15,2.80,2.366%,16538934117.00,United States,,978249,,
EMO,ClearBridge Energy Midstream Opportunity Fund Inc. Common Stock,$20.24,0.20,0.998%,274241435.00,United States,2011,56106,,
EMP,Entergy Mississippi LLC First Mortgage Bonds 4.90% Series Due October 1 2066,$26.005,0.045,0.173%,0.00,United States,2016,8910,,
EMPW,Empower Ltd. Class A Ordinary Shares,$9.95,0.00,0.00%,310937500.00,United States,2020,109284,,
EMR,Emerson Electric Company Common Stock,$91.11,0.18,0.198%,54668703416.00,United States,,3092501,,
ENB,Enbridge Inc Common Stock,$38.98,0.21,0.542%,78955784795.00,Canada,,3023761,,
ENBA,Enbridge Inc 6.375% Fixed-to-Floating Rate Subordinated Notes Series 2018-B due 2078,$26.54,-0.01,-0.038%,0.00,Canada,2018,47566,,
ENBL,Enable Midstream Partners LP Common Units representing limited partner interests,$7.57,0.16,2.159%,3299360019.00,,2014,728721,,
ENIA,Enel Americas S.A. American Depositary Shares,$7.28,0.01,0.138%,11078166882.00,Chile,,1617851,,
ENIC,Enel Chile S.A. American Depositary Shares (Each representing 50 shares of Common Stock),$3.64,0.09,2.535%,5035325364.00,,2016,985560,,
ENJ,Entergy New Orleans LLC First Mortgage Bonds 5.0% Series due December 1 2052,$25.89,0.16,0.622%,0.00,United States,,1448,,
ENLC,EnLink Midstream LLC Common Units representing Limited Partner Interests,$4.57,-0.03,-0.652%,2239521211.00,,,2141105,,
ENO,Entergy New Orleans LLC First Mortgage Bonds 5.50% Series due April 1 2066,$25.36,-0.01,-0.039%,0.00,United States,2016,10375,,
ENPC,Executive Network Partnering Corporation Class A Common Stock,$9.75,-0.04,-0.409%,420634500.00,,2020,25965,,
ENR,Energizer Holdings Inc. Common Stock,$49.96,0.20,0.402%,3415614121.00,United States,2015,254461,,
ENR^A,Energizer Holdings Inc. 7.50% Series A Mandatory Convertible Preferred Stock,$100.00,-0.0169,-0.017%,,United States,,8669,,
ENS,EnerSys Common Stock,$88.91,-2.30,-2.522%,3795300103.00,United States,2004,301819,,
ENV,Envestnet Inc Common Stock,$71.43,-0.98,-1.353%,3886570944.00,United States,2010,360277,,
ENVA,Enova International Inc. Common Stock,$34.92,-0.62,-1.745%,1277921774.00,United States,2014,369507,,
ENZ,Enzo Biochem Inc. Common Stock ($0.01 Par Value),$2.92,-0.05,-1.684%,140827416.00,United States,,304320,,
EOD,Wells Fargo Global Dividend Opportunity Fund,$5.48,-0.07,-1.261%,240042742.00,United States,2007,271813,,
EOG,EOG Resources Inc. Common Stock,$75.01,-0.96,-1.264%,43779336417.00,United States,,4649201,,
EOI,Eaton Vance Enhance Equity Income Fund Eaton Vance Enhanced Equity Income Fund Shares of Beneficial Interest,$17.92,0.02,0.112%,704684252.00,United States,2004,232521,,
EOS,Eaton Vance Enhance Equity Income Fund II Common Stock,$22.50,-0.23,-1.012%,1120171298.00,,2005,97889,,
EOT,Eaton Vance Municipal Income Trust EATON VANCE NATIONAL MUNICIPAL OPPORTUNITIES TRUST,$22.36,-0.19,-0.843%,342407266.00,United States,2009,17351,,
EP^C,El Paso Corporation Preferred Stock,$50.25,0.00,0.00%,,United States,,14392,,
EPAC,Enerpac Tool Group Corp. Common Stock,$27.77,0.16,0.58%,1669546618.00,United States,,313022,,
EPAM,EPAM Systems Inc. Common Stock,$458.52,-1.06,-0.231%,25759406458.00,United States,2012,524797,,
EPC,Edgewell Personal Care Company Common Stock,$39.62,0.68,1.746%,2150492498.00,,,670398,,
EPD,Enterprise Products Partners L.P. Common Stock,$23.16,0.21,0.915%,50525836129.00,United States,,6917741,,
EPR,EPR Properties Common Stock,$48.13,0.25,0.522%,3598518624.00,United States,1997,489402,,
EPR^C,EPR Properties 5.75% Series C Cumulative Convertible Preferred Shares,$26.19,0.03,0.115%,,United States,,2087,,
EPR^E,EPR Properties Series E Cumulative Conv Pfd Shs Ser E,$35.72,0.00,0.00%,,United States,,753,,
EPR^G,EPR Properties 5.750% Series G Cumulative Redeemable Preferred Shares,$25.2512,0.1812,0.723%,,United States,,12330,,
EPRT,Essential Properties Realty Trust Inc. Common Stock,$25.92,-0.49,-1.855%,3045515682.00,United States,2018,823286,,
EPWR,Empowerment & Inclusion Capital I Corp. Class A Common Stock,$9.77,0.02,0.205%,337065000.00,,2021,2335,,
EQC,Equity Commonwealth Common Shares of Beneficial Interest,$28.95,0.17,0.591%,3521623358.00,United States,,1061924,,
EQC^D,Equity Commonwealth 6.50% Pfd Conv Shs Ser D,$30.51,0.00,0.00%,,United States,,1507,,
EQD,Equity Distribution Acquisition Corp. Class A Common Stock,$9.99,0.02,0.201%,516982500.00,United States,2020,593834,,
EQH,Equitable Holdings Inc. Common Stock,$34.55,-0.02,-0.058%,14795499280.00,United States,2018,2775977,,
EQH^A,Equitable Holdings Inc. Depositary Shares,$26.37,0.07,0.266%,,United States,,26491,,
EQH^C,Equitable Holdings Inc. Depositary Shares each representing a 1/1000th interest in a share of Fixed Rate Noncumulative Perpetual Preferred Stock Series C,$24.93,0.08,0.322%,,United States,,28555,,
EQNR,Equinor ASA,$20.41,-0.16,-0.778%,66282849267.00,Norway,,2344913,,
EQR,Equity Residential Common Shares of Beneficial Interest,$72.33,-1.07,-1.458%,27051809063.00,United States,,2865130,,
EQS,Equus Total Return Inc. Common Stock,$1.90,0.01,0.529%,25684477.00,United States,,18637,,
EQT,EQT Corporation Common Stock,$19.91,0.16,0.81%,5551992398.00,United States,,3057903,,
ERF,Enerplus Corporation Common Stock,$5.60,0.03,0.539%,1246266560.00,Canada,,2062582,,
ERJ,Embraer S.A. Common Stock,$11.58,-0.11,-0.941%,2126546001.00,Brazil,2000,4154606,,
ES,Eversource Energy (D/B/A) Common Stock,$86.12,-0.30,-0.347%,29566808740.00,United States,,1103540,,
ESE,ESCO Technologies Inc. Common Stock,$109.36,-0.21,-0.192%,2847484403.00,United States,,74246,,
ESGC,Eros STX Global Corporation A Ordinary Shares,$1.19,-0.08,-6.299%,450927344.00,,2013,13831139,,
ESI,Element Solutions Inc. Common Stock,$22.38,0.48,2.192%,5538077209.00,United States,2014,2005759,,
ESM,ESM Acquisition Corporation Class A Ordinary Shares,$9.80,0.00,0.00%,0.00,,2021,60,,
ESNT,Essent Group Ltd. Common Shares,$52.37,-0.36,-0.683%,5909463008.00,,2013,677969,,
ESRT,Empire State Realty Trust Inc. Class A Common Stock,$11.94,0.29,2.489%,3406874933.00,United States,2013,2331930,,
ESS,Essex Property Trust Inc. Common Stock,$283.66,-3.15,-1.098%,18437590811.00,United States,1994,560468,,
ESTC,Elastic N.V. Ordinary Shares,$110.58,-3.67,-3.212%,9926191142.00,United States,2018,2163500,,
ESTE,Earthstone Energy Inc. Class A Common Stock,$7.80,0.46,6.267%,612677824.00,United States,,483454,,
ET,Energy Transfer LP Common Units ,$8.81,0.18,2.086%,23817715915.00,United States,,15309710,,
ET^C,Energy Transfer L.P. 7.375% Series C Fixed-to-Floating Rate Cumulative Redeemable Perpetual Preferred Unit,$23.83,-0.07,-0.293%,,United States,,49674,,
ET^D,Energy Transfer L.P. 7.625% Series D Fixed-to-Floating Rate Cumulative Redeemable Perpetual Preferred Unit,$24.12,-0.03,-0.124%,,United States,,59222,,
ET^E,Energy Transfer L.P. 7.600% Series E Fixed-to-Floating Rate Cumulative Redeemable Perpetual Preferred Unit,$24.34,-0.01,-0.041%,,United States,,83375,,
ETB,Eaton Vance Tax-Managed Buy-Write Income Fund Eaton Vance Tax-Managed Buy-Write Income Fund Common Shares of Beneficial Interest,$16.26,-0.09,-0.55%,435176136.00,United States,2005,36660,,
ETG,Eaton Vance Tax-Advantaged Global Dividend Income Fund Common Shares of Beneficial Interest,$20.12,-0.11,-0.544%,1535160306.00,United States,2004,95373,,
ETH,Ethan Allen Interiors Inc. Common Stock,$31.02,0.46,1.505%,780869004.00,United States,1993,564982,,
ETI^,Entergy Texas Inc 5.375% Series A Preferred Stock Cumulative No Par Value,$27.23,-0.11,-0.402%,,United States,,332,,
ETJ,Eaton Vance Risk-Managed Diversified Equity Income Fund Common Shares of Beneficial Interest,$10.94,0.07,0.644%,699133073.00,United States,2007,245837,,
ETN,Eaton Corporation PLC Ordinary Shares,$144.67,0.31,0.215%,57631239443.00,Ireland,,3727652,,
ETO,Eaton Vance Tax-Advantage Global Dividend Opp Common Stock,$28.93,-0.24,-0.823%,453657868.00,United States,2004,45407,,
ETR,Entergy Corporation Common Stock,$109.11,-0.12,-0.11%,21891079614.00,United States,,1325120,,
ETRN,Equitrans Midstream Corporation Common Stock ,$7.77,-0.32,-3.956%,3371645067.00,,2018,9773359,,
ETV,Eaton Vance Corporation Eaton Vance Tax-Managed Buy-Write Opportunities Fund Common Shares of Beneficial Interest,$15.94,-0.06,-0.375%,1476189867.00,United States,2005,227523,,
ETW,Eaton Vance Corporation Eaton Vance Tax-Managed Global Buy-Write Opportunites Fund Common Shares of Beneficial Interest,$10.78,0.08,0.748%,1158705807.00,United States,2005,526326,,
ETWO,E2open Parent Holdings Inc.Class A Common Stock,$10.81,-0.05,-0.46%,2407181524.00,,2020,927202,,
ETX           ,Eaton Vance Municipal Income 2028 Term Trust Common Shares of Beneficial Interest,$22.50,0.10,0.446%,244179450.00,,2013,6799,,
ETY,Eaton Vance Tax-Managed Diversified Equity Income Fund Common Shares of Beneficial Interest,$13.44,0.01,0.074%,2039076695.00,United States,2006,416330,,
